Cti Hazir Giyim Uretim Anonim Sirketi,Ct Konfeksiyon Ürün. Iç Ve Diş Tic. A.Ş.,TURKEY,Istanbul, 34173 , Istanbul,"Mehmet Nesih Ozmen Mahallesi Fatih Caddesi, Akcaagac Sok. No:2 Kat:3, Gungoren",True,False,False,True,False,False,False,False,False,52.0,48.0,,False,,,,,,1,500
"Dalian Jinzhou Longxin Garment Co., Ltd",Ventdest Garments Co Ltd,CHINA,Liaoning, 116000 , Dalian,"Xingshutun Town, Jinzhou, Yingkou",True,False,False,True,False,False,False,False,False,27.0,73.0,8.0,False,,,,l,,1,500
"Dalian Tian Yuan Wan Cheng Garment Co.,Ltd","Weihai Textile Group Import And Export Co., Ltd.",CHINA,Liaoning, 116000 , Dalian,No.32 Xianjin Street Of Jinzhou District,True,False,False,True,False,False,False,False,False,65.0,35.0,15.0,False,,,,,,1,500
Idea Stampa Srl,Idea Stampa Srl,ITALY,Venezia, 30020 , Meolo,"Via Delle Industrie Ii, 52",True,False,False,False,False,True,False,False,False,,,,False,,,,,,1,500
Igea Srl,Texapel S.P.A.,ITALY,Pistoia, 51037 , Montale,Via Alfieri 7/29,True,False,False,False,False,False,False,True,False,50.0,50.0,,False,,,,,,1,500
"Dalian Vent D' Est Garment Co., Ltd",Ventdest Garments Co Ltd,CHINA,Liaoning, 116100 , Dalian,"No 127 Heqing Road, Daweijia Street, Jinzhou District",True,False,False,True,False,False,False,False,False,24.0,76.0,6.0,False,,,,l,GRS     ,1,500
Ilka Baski Kumas Tekstil San,Giza Spinning And Weaving Co,TURKEY,Denizli, 20000 , Denizli,Organize Sanayi Bolgesi Husnu Ornek Caddesi No:27 Honaz,True,False,False,False,False,False,False,True,True,45.0,55.0,,False,,,,,,1,500
Ilka Baski Kumas Tekstil Sanayi Ve Tic. Ltd. Sti.,Ilka Baski Kumas Tekstil San Ve Tic Ltd Sti,TURKEY,Denizli, 20330 , Denizli,"Guzelkoy Mah, 257. Sk. No:9/C, Pamukkale",True,False,False,False,False,False,True,True,False,48.0,52.0,,False,,,,,,1,500
"Dalian Vent D'Est Lavado & Garments Co., Ltd",Ventdest Garments Co Ltd,CHINA,Liaoning, 116000 , Dalian,"Shenlu Village, Paotai Town, Puwan District, Dalian City",True,False,False,True,False,False,False,False,False,80.0,20.0,4.0,False,,,,,,1,500
"Indesmalla, S.A.",Indesmalla Sa,SPAIN,Barcelona, 08389 , Palafolls,"Ctra. N-Ii Km. 679,5",True,False,False,False,False,False,False,True,False,50.0,50.0,,False,,,,,,1,500
"Dandong Actex Garment Industry Co.,Ltd",Pwr Fashion Company Limited,CHINA,Liaoning, 118313 , Dandong City,"3# Zhongda Street,Gushan Town,Donggang",True,False,False,True,False,False,False,False,False,18.0,82.0,,True,Trade Union Committee of DANDONG ACTEX G,,,l,BSCI; GRS,1,500
Isil Tekstil San.Ve Tic.Ltd.Sti,Isil Tekstil San Ve Tic Ltd Sti,TURKEY,Nigde, 51000 , Nigde,Nigde Organize San Bolgesi Bor Yolu 7.Km Birko Cad. No 272,True,False,False,False,False,False,True,False,False,50.0,50.0,,False,,,,,,1,500
Isil Tekstil San.Ve Tic.Ltd.Sti - Istanbul,Isil Tekstil San Ve Tic Ltd Sti,TURKEY,Istanbul, 34524 , Istanbul,"Yakuplu, Girisi, Carsi Sk. Beysan Sanayi Sitesi No:3, Beylikduzu",True,False,False,False,False,False,False,True,False,89.0,11.0,,False,,,,,,501,1500
Isil Tekstil San.Ve Tic.Ltd.Sti - Tekirdag,Demka Tekstil San Ve Tic As,TURKEY,Tekirdag, 59850 , Tekirdag,Ulas Mah. Asfalt Boyu Kume Evler No 16 Ergene 2 Osb,True,False,False,False,False,False,False,True,True,70.0,30.0,,False,,,,,,501,1500
Iskur Boya Tekstil Tic. Ve San. A.S.,Iskur Iplik Kumas Mensucat,TURKEY,Kahramanmaras, 46090 , Kahramanmaras,Karacasu Ferhus Mah. Havaalani Cad. No:39A Dulkadiroglu,True,False,False,False,False,False,False,False,True,70.0,30.0,,False,,,,,,501,1500
Iskur Tekstil Enerji Ticaret Ve Sanayi Anonim Sirketi,Iskur Iplik Kumas Mensucat,TURKEY,Kahramanmaras, 46100 , Dulkadiroglu,Genc Osman Mah. Recep Tayyip Erdogan Bul. Iskur Tekstil Sitesi No:97/A,True,False,False,False,False,False,True,True,False,50.0,50.0,,False,,,,,,1,500
Jain Cord Industries Pvt Ltd,Radnik Exports,INDIA,Uttar Pradesh, 281401 , Mathura,"Dohtana, Chandori Road, Chhata, Distt. Mathura",True,False,False,False,False,False,False,True,True,90.0,10.0,,False,,,,,,1501,3000
Jeans Culture Ltd,Tarasima Apparels Ltd,BANGLADESH,Dhaka, 1216 , Dhaka,"Ind. Plot # 4, Section # 7, Milk Vita Rd. Mirpur, Dhaka 1216",True,False,False,False,False,False,False,False,True,77.0,23.0,,False,,,,,,501,1500
"Dangshan Gtgh Garment Co., Ltd.","Jiangsu Guotai Int'L Group Guohua Corp., Ltd.",CHINA,Anhui, 235300 , Dangshan,"Building 5, Standardized Workshop, Economic Development Zone",True,False,False,True,False,False,False,False,False,10.0,90.0,0.0,True,"GARMENT INDUSTRY CO.,LTD.",,,l,,1,500
Jersey Lomellina S.P.A.,Jersey Lomellina Spa,ITALY,Bergamo, 24030 , Carvico,"Via Don A. Pedrinelli, 94",True,False,False,False,False,False,False,True,False,,,,False,,,,,,,
"Jiang Yin Yingming Textile Finishing Co,Ltd","Jiangsu Guotai Huasheng Industrial Co.,Ltd",CHINA,Jiangsu, 214174 , Wuxi,Jiang Yin Zhouzhuang Town Xingquan Village Xingquan Road,True,False,False,False,False,False,False,False,True,70.0,30.0,,False,,,,,,1,500
"Jiangmen Weimei Elastic Fabric Co., Ltd",Pavilion Investment Ltd,CHINA,Guangdong, 529000 , Jiangmen City,"Jinzhou Road, Jinguzhou, Xinhui District",True,False,False,False,False,False,False,True,True,,,9.0,True,"Trade Union Committee of Sanjiang Town, Xinhui District, Jiangmen City",,,,GRS; ISO 14001; ISO 45001 ,1,500
Debby Line S.R.L.,Debby Line S.R.L.,ITALY,Treviso, 31038 , Paese,"Via Friuli, 13",True,False,False,True,False,False,False,False,False,60.0,40.0,,False,,,,,,1,500
"Jiangsu Hengli Chemical Fibre Co., Ltd",Sunhong Global Investment Limited,CHINA,Jiangsu, 215200 , Suzhou,"Wujiang City,  South Flax Industrial Zone Hengli Road No. 1",True,False,False,False,False,False,False,True,False,,,,False,,,,,,,
Debonair Limited,Debonair Limited,BANGLADESH,Dhaka, 1341 , Ashulia,"Gorat,Sarker Market Road, Ashulia",True,False,False,True,False,False,False,False,False,40.0,60.0,0.0,True,Debonair Limited Workers Union,,,l,,1501,3000
"Jiangsu Peng Cheng (Group) Dyeing And Finishing Co., Ltd",Alpi (Hong Kong) International Company Limited.,CHINA,Jiangsu, 221000 , Xuzhou,Qingshanquan Town  Jiawang District,True,False,False,False,False,False,False,False,True,,,,False,,,,,,1,500
"Jiangsu Pinytex Textile Dyeing& Finishing Co.,Ltd.",The Rose Dresses Ltd,CHINA,Jiangsu, 213000 , Changzhou,No.165 South Qingyang Road,True,False,False,False,False,False,False,True,True,30.0,70.0,19.0,True,hutang labor union,,,l,GOTS; ISO 14001; ISO 45001  ,501,1500
"Jiangsu Xinmin Textile Science&Technology Co.,Ltd","Win-Light Textiles Co., Ltd.",CHINA,Jiangsu, 215200 , Wujiang,"22# Wulong Road, Shenzhe Town",True,False,False,False,False,False,False,True,False,78.0,22.0,,False,,,,,,1,500
"Jiangyin Benda Garment Co.,Ltd",Pavilion Investment Ltd,CHINA,Jiangsu, 214400 , Jiangyin,"No.2 Huachang Road, Zhutang Town",True,False,False,False,False,False,False,True,True,40.0,60.0,,False,,,,,,501,1500
"Jiangyin Dkl Textile Co.,Ltd","Jiangsu Guotai Huasheng Industrial Co.,Ltd",CHINA,Jiangsu, 214400 , Jiangyin,"No.76, Jincheng Road, Jinwan Village, Zhouzhuang Town",True,False,False,False,False,False,False,True,False,20.0,80.0,,False,,,,,,1,500
"Jiangyin Jiangzhou Printing & Dyeing Co., Ltd",Tarasima Apparels Ltd,CHINA,Jiangsu, 214400 , Jiangyin,"No. 28 Dongsheng Road, Shanguan, Chengdong Street",True,False,False,False,False,False,False,True,True,65.0,35.0,,False,,,,,,1,500
Jiangyin Meijie Knitting Co.Ltd,"Shangtex Garment.Co.,Ltd",CHINA,Jiangsu, 110000 , Shengang,No.8 Shen Xin Road Shen Gang Town Industrual Zone,True,False,False,False,False,False,True,True,True,,,30.0,False,,,,l,,1,500
Jiangyin Tianye Knitting Co. Ltd.,Talisman Ltd,CHINA,Jiangsu, 214400 , Jiangyin,"No.45-2,Zhaojiadang,Nanguo Village,Changjing Town",True,False,False,False,False,False,False,True,False,85.0,15.0,,False,,,,,,1,500
"Jiangyin Xingwu Woolen Technology Co.,Ltd","Richland(Liaoning)Int'L Co., Ltd",CHINA,Jiangsu, 214400 , Jiangyin,"No.86,Xingyuan Road, Changjing Town",True,False,False,False,False,False,False,True,True,58.0,42.0,,False,,,,,,501,1500
Jiangyin Yu Long,"Jiangsu Guotai Huasheng Industrial Co.,Ltd",CHINA,Jiangsu, 214400 , Jiangyin,No:28 Jiangyin Zhouzhuang Industrial Park,True,False,False,False,False,False,False,True,False,,,,False,,,,,,1,500
"Jiangyin Zhouzhuang Dyeing And Finishing Co., Ltd.","Jiangsu Guotai Huasheng Industrial Co.,Ltd",CHINA,Jiangsu, 214000 , Wuxi,"No.6 Longdong Road, Zhouzhuang Zhen, Jiangyin Town.",True,False,False,False,False,False,False,False,True,50.0,50.0,,False,,,,,,1,500
Jiangying Deze Textile Co.Ltd.,Talisman Ltd,CHINA,Jiangsu, 214400 , Jiangyin,"Open Source Road, Yunting Street",True,False,False,False,False,False,False,True,False,50.0,50.0,,False,,,,,,3001,5000
Jiaxing Port Area Jiayang Washing Factory,"Jiangsu Guotai Huasheng Industrial Co.,Ltd",CHINA,Zhejiang, 314000 , Jiaxing,"Duoling Industrial Park,Zhapu Town",True,False,False,False,False,False,False,False,True,80.0,20.0,,False,,,,,,1,500
"Jiaxing Xinqiao Dyeing And Finishing Co., Ltd",Focus Development Limited,CHINA,Zhejiang, 314016 , Jiaxing,"18 Qiumao Road, Wangjiangjing Town, Xiuzhou District",True,False,False,False,False,False,True,False,True,65.0,35.0,68.0,True,Jiaxing City Labor Union,,,l,,1,500
Demka Moda Textile San Ve Dis Tic As,Demka Tekstil San Ve Tic As,TURKEY,Adiyaman, 02040 , Adiyaman,Petrol Osb Mah.16. Cad. No:12/A,True,False,False,True,False,False,False,False,True,50.0,50.0,0.0,False,,,,l,GOTS; GRS ,1,500
Demkor,Demka Tekstil San Ve Tic As,TURKEY,Istanbul, 34255 , Istanbul,Karayollari Mah. 562.Sok. No.20,True,False,False,True,False,False,False,False,False,50.0,50.0,0.0,False,,,,l,,1,500
Denimach Ltd,Denimach Ltd,BANGLADESH,Dhaka, 283203 , Gazipur,"Kewa Mouja, Ward-5, Gorgoria, Masterbari, Sreepur",True,False,False,True,False,False,False,False,False,45.0,55.0,,True,Denimach Ltd. Sommilito Sramik Kormochari Unionn/a; Denimach Ltd. Sramik Union,,,,,5000,
Denitex Limited,Denitex Ltd,BANGLADESH,Dhaka, 1340 , Savar,"9/1, Karnapara",True,False,False,True,False,False,False,False,True,22.0,78.0,,True,Denitex Limited Sromik Kormochari Union,,,l,GOTS; OCS; RCS,1,500
Junxiang Print Company,"Shangtex Garment.Co.,Ltd",CHINA,Jiangsu, 223000 , Huai An,No.638 Xiang Yu Road (North),True,False,False,False,False,True,False,False,False,,,,False,,,,,,1,500
"Kai Ping Panther Textiles Co., Ltd  (Denim)",Tarasima Apparels Ltd,CHINA,Guangdong, 529339 , Kaiping,"No.21, Mei Hua Road, Shui Kou Town",True,False,False,False,False,False,False,True,True,,,4.0,True,Kaiping City Federation of Trade Unions,,,l,,1,500
"Kai Ping Panther Textiles The 3Rd Co.,Ltd",S.F Denim Apparels Ltd.,CHINA,Guangdong, 529339 , Kaiping,"3 Number 8, Long Tang West Road, Shui Kou Town.",True,False,False,False,False,False,False,True,False,,,,False,,,,,,1,500
"Kai Ping Tat Fung Weaving, Dyeing,Printing&Garment Co.,Ltd,",Talisman Ltd,CHINA,Guangdong, 529339 , Kaiping,"Block 24, No.21, Mei Hua Road, Shui Kou Town",True,False,False,False,False,False,False,True,True,58.0,42.0,14.0,True,Kaiping City Federation of Trade Unions,,,l,,1,500
Kale Iplik Sanayi Ve Dis Ticaret A.S.,Ilka Baski Kumas Tekstil San Ve Tic Ltd Sti,TURKEY,Tekirdag, 59740 , Marmara Ereglisi,Seymen Yolu Cad. No: 57/D Cedit Ali Pasa Mah.,True,False,False,False,False,False,True,False,False,,,,False,,,,,,1,500
Kallam Textile Ltd.,Radnik Exports,INDIA,Andhra Pradesh, 523001 , Prakasam,"No. 198/2, Kunkupadu ( Village), Addanki",True,False,False,False,False,False,False,True,False,68.0,32.0,,False,,,,,,1,500
Kara Fiber Elyaf San. Tic. A.S,Kasar Ve Dual Tekstil,TURKEY,Gaziantep, 27000 , Gaziantep,"2. Osb 83221, Nolu Cd No:6",True,False,False,False,False,False,True,False,False,50.0,50.0,,False,,,,,,1,500
Karafiber Tekstil. San. Tic. A.S,Pergamon Status Dis Ticaret As,TURKEY,Gaziantep, 27100 , Gaziantep,2. Osb 83221 Nolu Cad. No: 6 Sehitkamil,True,False,False,False,False,False,True,False,False,,,,False,,,,,,1,500
Karsu Tekstil San. Tic. A.S.,Ilka Baski Kumas Tekstil San Ve Tic Ltd Sti,TURKEY,Kayseri, 38560 , Incesu,Suksun Zafer Mh.Sedef Bulv.No:146,True,False,False,False,False,False,True,False,False,50.0,50.0,,False,,,,,,1,500
Karteks,Gamateks Tekstil Sanayi Ve Tic. As,TURKEY,Adana, 01120 , Siricam,Adana Haci Sabanci Organize Sanayi Bolgesi Karacaoglan Cad. No:4,True,False,False,False,False,False,True,False,True,50.0,50.0,,False,,,,,,1,500
Kasar Ve Dual Tekstil,Benetton Industrielle Tunisie Sarl,TURKEY,Istanbul, 34015 , Topkapi - Istanbul,Davutpasa Cad.Yildiz Sk. No.3,True,False,False,False,False,False,True,False,False,82.0,18.0,,False,,,,,,501,1500
Kasar Ve Dual Tekstil San.A.S.,Kasar Ve Dual Tekstil,TURKEY,Tekirdag, 59930 , Tekirdag,"Ergene-1 Osb, Vakiflar Osb Mah. D100 Cad. No:16/1",True,False,False,False,False,False,True,True,True,82.0,18.0,,False,,,,,,501,1500
Kassim Textiles Ltd,Sterling Apparels Ltd.,PAKISTAN,Sindh, 75100 , Karachi,"P 62 National Hwy 5, Bin Qasim Town",True,False,False,False,False,False,False,True,True,99.0,1.0,,False,,,,,,501,1500
Denizli Rateks Tekstil San. Ve Tic. A.Ş.,Ilka Baski Kumas Tekstil San Ve Tic Ltd Sti,TURKEY,Denizli, 20020 , Denizli,"Bozburun, 7050. Sk., Denizli",True,True,False,True,False,False,False,False,True,30.0,70.0,0.0,False,,,,l,,501,1500
Dhahritex,Benetton Industrielle Tunisie Sarl,TUNISIA,Kasserine, 1200 , Kasserine,Rue Mechtel Route Sbitla,True,False,False,True,False,False,False,False,False,5.0,95.0,0.0,False,,l,78.0,l,,1,500
Kipas Mensucat Isletmeleri A.S.,Kipas Pazarlama Ve Ticaret A.S.,TURKEY,Kahramanmaras, 46090 , Kahramanmaras,Karacasu Karaziyaret Mah. Fatih Sultan Mehmet Cad.N°1 /A Dulkadiroglu,True,False,False,False,False,False,True,True,True,98.0,2.0,,False,,,,,,3001,5000
Konak Tul Perde Sanayii A.S.,Konak Tul Perde Sanayii A.S.,TURKEY,Istanbul, 34315 , Istambul,13 34315 Ambarli Avcilar,True,False,False,False,False,False,False,True,False,,,,False,,,,,,,
Korteks Iplik,Isil Tekstil San Ve Tic Ltd Sti,TURKEY,Bursa, 16000 , Bursa,Organize Sanayi Bölgesi Sari Cad. No:3,True,False,False,False,False,False,True,False,False,50.0,50.0,,False,,,,,,1,500
Korteks Mens.San.Ve Tic.A.S.,Konak Tul Perde Sanayii A.S.,TURKEY,Istanbul, 34394 , Sisli,"Levent 199, Buyukdere Cad. No:199",True,False,False,False,False,False,True,False,True,50.0,50.0,,False,,,,,,1,500
Dice For Ready Made Garments,Dice For Ready Made Garments,EGYPT,Qalyubia, 13611 , Qalyub,67 Cairo-Alexandria Agriculture Road,True,False,False,True,False,False,False,False,True,45.0,55.0,0.0,False,,,,l,,1501,3000
Kwong Hing (Zhong Shan) Weaving Dyeing & Printing Company Ltd.,Hutton Global Trading Limited,CHINA,Guangdong, 528400 , Zhongshan,"No. 18 Guang Xin Road, Da Yan Industrial Zone, Huang-Pu Town",True,False,False,False,False,False,False,False,True,60.0,40.0,,False,,,,,,1,500
L.C.A. Srl,Ellea Srl,ITALY,Prato, 59100 , Prato,"Via Fonda Di Mezzana, 35",True,False,False,False,False,False,False,False,True,50.0,50.0,,False,,,,,,1,500
Dice For Ready Made Garments,Dice For Ready Made Garments,EGYPT,Cairo, 11757 , Heliopolis,5 & 6 Petrol St. From Gessr El-Suez St. Industrial Area,True,False,False,True,False,False,False,False,False,56.0,44.0,0.0,False,,,,l,ISO 14001; ISO 45001  ,501,1500
Dice For Ready Made Garments 2,Dice For Ready Made Garments,EGYPT,Cairo, 11788 , El Salam City First,K 18 Moktar Abaza St. – Ismaileya Road,True,False,False,True,False,True,False,False,False,45.0,55.0,0.0,False,,,,l,,1,500
"Dongguan Weiqi Hangbag Co., Ltd.","Wenzhou Lonson Import And Export Co.,Ltd.",CHINA,Guangdong, 523000 , Dongguan City,"1# Building, No. 13 Shichang Road, Dongsheng District,",False,True,False,True,False,False,False,False,False,54.0,46.0,0.0,False,,,,l,,1,500
Dressing Diffusion Srl,Dressing Diffusion Srl,ITALY,Rovigo, 45015 , Corbola,"Via Lazzara, 31",True,False,False,True,False,False,False,False,False,10.0,90.0,,False,,,,,,1,500
Dyontex (Anhui) Industries Ltd,Focus Development Limited,CHINA,Anhui, 243000 , Maanshan,"No. 8 Yuyuan Rd, Yushan, Maanshan",True,False,False,True,False,False,False,False,False,17.0,83.0,3.0,False,,,,,,1,500
Lanificio Dell'Olivo S.P.A.,Lanificio Dell'Olivo S.P.A.,ITALY,Prato, 59100 , Prato,"Viale Vittorio Veneto, 80",True,False,False,False,False,False,True,False,False,,,,False,,,,,,,
Effe Confezioni S.R.L.,Effe Confezioni S.R.L.,ITALY,Rovigo, 45014 , Porto Viro,"Via Dell'Artigianato, 9",True,False,False,True,False,False,False,False,False,10.0,90.0,,False,,,,,,1,500
Effetto Lana E Cotone S.R.L.,Effetto Lana E Cotone S.R.L.,ITALY,Treviso, 31055 , Quinto Di Treviso,"Via San Cassiano, 27",True,False,False,True,False,False,False,False,False,5.0,95.0,,False,,,,,,1,500
Lavanderia Industriale Tessile,Lavanderia Industriale Tessile,ITALY,Venezia, 30038 , Spinea,"Via Negrelli, 11",True,False,False,False,False,False,False,False,True,50.0,50.0,,False,,,,,,1,500
Lavanderia Squilloni,Lorenzo Tessuti Srl,ITALY,Prato, 59013 , Montemurlo,"Via Labriola, 212",True,False,False,False,False,False,False,False,True,100.0,0.0,,False,,,,,,1,500
Elsayaad Tricot Co.,Elsayaad Tricot Co,EGYPT,Gharbia, 31951 , El-Mahalla El-Kobra,37 Sadat St. Damro Road,True,False,False,True,False,True,False,True,False,41.0,59.0,0.0,True,el sayaad workers union,l,100.0,l,GOTS   ,1,500
Enkay Export (India) Limited,G.Moretti Srl,INDIA,Uttar Pradesh, 282007 , Agra,"C-94, C-134 To C-138 Epip Shatri Puram",False,True,False,True,False,False,False,False,False,70.0,30.0,,False,,,,,,501,1500
Euno Srl,Euno Srl,ITALY,Treviso, 31056 , Roncade,"Via Manera, 20",True,False,False,True,False,False,False,False,False,10.0,90.0,,False,,,,,,1,500
Lb Tex Srl,Tessitura Rossi Spa,ITALY,Modena, 41016 , Rovereto Sul Secchia,"Via Giovanni Pascoli, 47",True,False,False,False,False,False,False,True,False,50.0,50.0,,False,,,,,,1,500
Ever-Blooming Manufactory Enterprises,Gazelle Enterprises Ltd.,CHINA,Guangdong, 523331 , Dongguan City,"Room 201, Block 2, 99 Shi Pai Da Road West , Shipai Town,",False,True,False,True,False,False,False,False,False,33.0,67.0,29.0,False,,,,l,,1,500
Everest S.R.L. Con Socio Unico,Everest S.R.L. Con Socio Unico,ITALY,Padova, 35017 , Piombino Dese,"Via Ghebo, 32",True,False,False,True,False,False,False,False,True,64.0,36.0,,False,,,,,,1,500
F.Lli Fabiano Srl,F.Lli Fabiano S.R.L.,ITALY,Barletta Andria Trani, 76125 , Trani,"Via Castriota Skandenberg, N. 36",False,False,True,True,False,False,False,False,False,100.0,0.0,0.0,True,CGL,l,100.0,l,,1,500
Linz Textil Gesellschaft M.Gb.H.,Matias & Araujo Sa,AUSTRIA,Upper Austria, 4030 , Linz,Wiener Str. 435,True,False,False,False,False,False,True,False,False,,,,False,,,,,,1,500
Lisa Keqiao Co. Ltd,Sunhong Global Investment Limited,CHINA,Shanghai, 200120 , Shanghai,"Room D,32F, New Shanghai Inernational Tower ,360,South Pudong Road, Pudong District",True,False,False,False,False,False,False,True,False,,,,False,,,,,,1,500
Filmod Sarl,Miroglio Textile S.R.L,MOROCCO,Casablanca, 20250 , Casablanca,"Lot 154, Zone Industrielle Ben M'Sick Sidi Othmane ",True,False,False,True,False,False,False,False,False,20.0,80.0,,False,,,,l,,501,1500
"Lixian Fulige Jibu Ltd., Co.",Ventdest Garments Co Ltd,CHINA,Hebei, 071000 , Baoding,Lixian Industrial Park,True,False,False,False,False,False,False,True,False,55.0,45.0,,False,,,,,,1,500
Fital Shpk,Fital Shpk,ALBANIA,Tirana, 1028 , Tirana,"Rruga ""Vangjel Ceco"", Kompleksi I Magazinave, Kombinat",False,False,True,True,False,False,False,False,False,40.0,60.0,0.0,False,,,,l,,501,1500
"Longxinglong Dyeing&Knitting Industry Co.,Ltd.Shishi",Lavender Garment Ltd,CHINA,Fujian, 362700 , Shishi,Jinshang Industrical,True,False,False,False,False,False,False,False,True,98.0,2.0,,False,,,,,,1,500
Look 87,Ellea Srl,ITALY,Prato, 59013 , Montemurlo,"Via F. Strozzi, 37",True,False,False,False,False,False,False,True,False,90.0,10.0,,False,,,,,,1,500
Lorenzo Tessuti Srl,Lorenzo Tessuti Srl,ITALY,Pistoia, 51037 , Pistoia,"Via Guido Rossa,33",True,False,False,False,False,False,False,True,False,70.0,30.0,,False,,,,,,1,500
Lucky Yarn Tex India Pvt. Ltd.,Radnik Exports,INDIA,Tamil Nadu, 637304 , Namakkal,"Sf35/2 Anangoor Road ,Nettavelampalayam Tiruchengode",True,False,False,False,False,False,False,True,False,30.0,70.0,,False,,,,,,501,1500
Lufeng Company Ltd,Garments Export Village Ltd.,CHINA,Shandong, 255100 , Zibo,"Jiaowang Road, North Side, Huangjiapu Town, Zichuan District",True,False,False,False,False,False,False,True,True,,,1.0,True,Zichuan District Federation of Trade Union,l,100.0,l,,1,500
"Luthai Textile Co.,Ltd",Lavender Garment Ltd,CHINA,Shandong, 255100 , Zibo,"No.97 East Songling Road ,Zichuan District",True,False,False,False,False,False,False,True,True,50.0,50.0,0.0,True,Unknown,l,100.0,l,,5000,
Lutuf Mensucat,Aktek Giyim San Ve Tic A.S.,TURKEY,Kahramanmaras, 46100 , Kahramanmaras,"Eyup Sultan Mah, Sumer Cad No:1/A, Dulkadiroglu",True,False,False,False,False,False,False,True,False,95.0,5.0,,False,,,,,,501,1500
Lv Textiles - Unit Erode,Radnik Exports,INDIA,Tamil Nadu, 638001 , Tamil Nadu,7 Kandaswamy Street Marg Erode,True,False,False,False,False,False,False,True,False,,,,False,,,,,,1,500
"M.N. Dyeing, Printing & Washing Mills Ltd.",Mascotex Limited,BANGLADESH,Dhaka, 1700 , Gazipur,"Baniarchala, Bhabanipur, Gazipur Sadar",True,False,False,False,False,False,False,False,True,98.0,2.0,86.0,False,,,,l,GOTS; OCS  ,1501,3000
"Ma'Anshan Jin Run Garment Co., Ltd",Focus Development Limited,CHINA,Anhui, 243000 , Maanshan,"No.148 Taodian Road, Huashan Industrial Garden",True,False,False,False,False,True,False,False,False,,,,False,,,,,,1,500
Maglificio Biliato S.R.L.,Maglificio Biliato S.R.L.,ITALY,Padova, 35010 , Trebaseleghe,"Via Stradona, 14",True,False,False,False,False,False,False,True,False,20.0,80.0,,False,,,,,,1,500
Mahmud Denims Ltd - Factory I,Sterling Apparels Ltd,BANGLADESH,Gazipur, 1751 , Kaliakoir,Shafipur,True,False,False,False,False,False,False,True,True,90.0,10.0,80.0,False,,,,l,,1501,3000
Friven Di Riccardo Parutto,Friven Di Riccardo Parutto,ITALY,Treviso, 31021 , Mogliano Veneto,"Via E. Torricelli, 26",False,False,True,True,False,False,False,False,False,0.0,100.0,0.0,False,,l,100.0,l,,1,500
Manifattura La Rocca Di Rossano Pamela,Cofil S.R.L.,ITALY,Prato, 59013 , Montemurlo,"Via Dell'Agricoltura, 41",True,False,False,False,False,False,True,False,False,,,,False,,,,,,1,500
Manifattura Venezia S.R.L.,Cofil S.R.L.,ITALY,Prato, 59013 , Montemurlo,"Via Dell'Artigianato, 22",True,False,False,False,False,False,True,False,False,,,,False,,,,,,1,500
Marchi & Fildi Spa,Marchi & Fildi Spa,ITALY,Biella, 13900 , Biella,"Via Maestri Del Lavoro, 4/A",True,False,False,False,False,False,True,False,False,,,,False,,,,,,,
G.R.G. Oficina Sarl,Benetton Industrielle Tunisie Sarl,TUNISIA,Nabeul, 8010 , Menzel Bouzelfa,Route De Soliman - Km 2,True,False,False,True,False,False,False,False,True,10.0,90.0,0.0,False,,l,100.0,l,,1,500
"Maria Gili Margenats, S.L","Maria Gili Margenats, S.L",SPAIN,Barcelona, 08397 , Pineda De Mar,"Marconi 26, Pol. Ind. Mas Roger",True,False,False,False,False,False,True,False,True,50.0,50.0,,False,,,,,,1,500
Maritas Denim San. Tic.A.S,Maritas Denim As,TURKEY,Kahramanmaras, 46080 , Kahramanmaras,Aksu Mah. Kazancizade Sadi Bulvari 29/A Dulkadiroglu,True,False,False,False,False,False,False,True,True,60.0,40.0,,False,,,,,,1,500
Maritas Tekstil Sanayi Ve  Dis Ticaret A.S,Maritas Denim As,TURKEY,Kahramanmaras, 46100 , Kahramanmaras,"O.S.B. 7.Cadde, No:5 Kahramanmaras",True,False,False,False,False,False,True,False,False,60.0,40.0,,False,,,,,,1,500
Marlow Production,Miroglio Textile S.R.L,MOROCCO,Casablanca, 20250 , Casablanca,Quartier Industriel Ain Sebaa Boulevard Al Kimiaa H 10-11-12,True,False,False,False,False,False,False,False,True,50.0,50.0,,False,,,,,,1,500
Garments Export Village Ltd.,Garments Export Village Ltd.,BANGLADESH,Dhaka, 1710 , Gazipur,"Maa Tower, Kbm Road, Tongi Industrial Area",True,False,False,True,False,False,False,False,False,43.0,57.0,36.0,False,,,,l,,1501,3000
Masco Industries Ltd,Mascotex Ltd,BANGLADESH,Dhaka, 1704 , Gazipur,"221-223, Sataish, Khartail, Tongi",True,False,False,False,False,False,False,True,True,97.0,3.0,38.0,True,Bangladesh Independent Garment Workers Union Federation (BIGUF),,,,ICS    ,501,1500
Masco Industries Ltd (Knitting Unit),Mascotex Ltd,BANGLADESH,Dhaka, 1430 , Narayangonj,"Kendua,Kanchan,Rupgonj,Narayangonj",True,False,False,False,False,False,False,True,False,99.0,1.0,,False,,,,,,501,1500
Masco Printing & Embroidery Ltd,Mascotex Ltd,BANGLADESH,Dhaka, 1230 , Gazipura,"15/4 Sataish Road, M.I Khan Bhaban, Sataish Maidda Para, Tongi",True,False,False,False,False,True,False,False,False,67.0,33.0,,False,,,,,,1501,3000
Giemmeti S.A.R.L.,Benetton Industrielle Tunisie Sarl,TUNISIA,Monastir, 5010 , Ouardanine,Route De Monastir,True,False,False,True,True,False,False,False,True,9.0,91.0,,False,,,,,,1,500
Master Line For Textile Industries,Dice For Ready Made Garments,EGYPT,Sharqia, 44629 , 10Th Of Ramadan,Industrial Zone B3,True,False,False,False,False,False,False,True,True,99.0,10.0,,False,,,,,,501,1500
Matesa Tekstil Sanayi Ve Ticaret,Torcitura Di Domaso Srl,TURKEY,Kahramanmaras, 46060 , Kahramanmaras,Aksu Mah. Gazi Mustafa Kemal Bulvari No:135/A Dulkadiroglu,True,False,False,False,False,False,True,False,False,37.0,63.0,,False,,,,,,,
Matias & Araujo Lda,Matias & Araujo Sa,PORTUGAL,Braga, 4750-543 , Barcelos,"Tv. Da Cruz De Pedra 13, Lijo",True,False,False,False,False,False,False,True,True,,,,False,,,,,,,
Mayteks Orme San Tic A.S.,Pergamon Status Dis Ticaret As,TURKEY,Izmir, 35000 , Izmir,A Osb 10007 Sok No 20,True,False,False,False,False,False,False,True,False,50.0,50.0,,False,,,,,,1,500
Mayteks Orme San Ve Tic A.S.,Pergamon Status Dis Ticaret As,TURKEY,Manisa, 45030 , Manisa,"Ataturk Cad. No:1, Kecilikoy O.S.B Yunusemre",True,False,False,False,False,False,False,False,True,85.0,15.0,,False,,,,,,501,1500
Giza Spinning & Weaving Co.,Giza Spinning And Weaving Co,EGYPT,Giza, 12943 , Kerdasa,"Kafr Hakeem, Abou Rawash",True,True,False,True,False,True,False,True,True,61.0,39.0,0.0,False,,,,l,,3001,5000
Mem Pazarlama Limited Sti,Aba Tekstil Orme San Ve Tic As,TURKEY,Kahramanmaras, 46100 , Kahramanmaras,Graziantep Yolu Erkenez Mevkill 52,True,False,False,False,False,False,True,False,False,,,,False,,,,,,,
