Mercury Fabrics Pvt Ltd,Shahi Exports Pvt Ltd.,INDIA,Haryana, 123501 , Bawal,"171-172, Sector-3, Growth Centre Bawal, Distt. Rewari",True,False,False,False,False,False,False,True,True,100.0,0.0,,False,,,,,,1,500
Glamor Fashion,Benetton Industrielle Tunisie Sarl,TUNISIA,Kasserine, 1200 , Foussana,Rue El Fateh,True,False,False,True,False,False,False,False,False,7.0,93.0,,False,,,,,,1,500
"Metal Film Printing Co., Ltd",Ha Hae Corporation,MYANMAR,Yangon, 11421 , Yangon,"No.(30/70)  Thakhin Ba Hein Road, North Dagon Township",True,False,False,False,True,False,False,False,False,43.0,57.0,,False,,,,,,1,500
"Ming Der Embroidery (Cambodia) Co., Ltd",Alpi (Hong Kong) International Company Limited.,CAMBODIA,Phnom Penh, 120801 , Phnom Penh,"#322, St. Plov Lum, Phum Chak Chruk, Sangkat Samraong Kraom, Khan Porsenchey",True,False,False,False,True,False,False,False,False,30.0,70.0,,False,,,,,,1,500
Glory Knitwear Limited,Ever Brighton (Hk) Ltd,CAMBODIA,Kandal, 080101 , Baek Chan,"National Rd. No.4, Kao Village, Angk Snoul District",True,False,False,True,False,False,False,False,True,22.0,78.0,28.0,True,Solidarity Union of Glory Knitwear (Sahakjib Samaki Pheap),,,,,501,1500
Gsc Manufacturing,Benetton Industrielle Tunisie Sarl,TUNISIA,Gafsa, 2100 , Gafsa,Zone Industrielle Laaguila,True,False,False,True,False,False,False,False,False,15.0,85.0,,False,,,,,,1,500
Miroglio Textile Srl,Matias & Araujo Sa,ITALY,Asti, 14054 , Castagnole Delle Lanze,"Strada Valle Tanaro, 57",True,False,False,False,False,False,True,False,False,,,,False,,,,,,,
Mizuda Textile Printing & Dyeing Group Co Ltd,Great Pacific Enterprises Ltd,CHINA,Zhejiang, 313000 , Huzhou,"No. 588 Mizuda Road, Wuxin District",True,False,False,False,False,False,False,False,True,70.0,30.0,49.0,True,Confederation: Union of Huzhou Wuxing Huanzhu Street,,,,ISO 45001   ,501,1500
Mks - Manufacture De Ksar Said,Niggeler & Kupfer Textile Spa,TUNISIA,Tunis, 1000 , Tunisi,"30, R. Du Tissage, Zi",True,False,False,False,False,False,False,True,False,79.0,21.0,,False,,,,,,1,500
"Moda 21 - Tinturaria E Acabamentos Texteis, Sa",Sidonios Malhas S.A.,PORTUGAL,Braga, 4700-565 , Braga,"Alameda De Ruaes 51, Mire De Tibaes",True,False,False,False,False,False,False,False,True,84.0,16.0,,False,,,,,,1,500
Modasan Tekstil San Ve Tic A.S.,Isil Tekstil San Ve Tic Ltd Sti,TURKEY,Kahramanmaras, 46100 , Dulkadiroglu,Eyup Sultan Cad Recep Tayyip Erdogan Bulvari No 128/A,True,False,False,False,False,False,False,False,True,50.0,50.0,,False,,,,,,1,500
Modena Mensucat San. Ve Tic. A.S.,Aktek Giyim San Ve Tic A.S.,TURKEY,Kahramanmaras, 46100 , Kahramanmaras,"Kavlakli Fatih, 3. Cad No: 2, Osb, Onikisubat",True,False,False,False,False,False,False,True,False,95.0,5.0,,False,,,,,,1,500
Mony Prints,Cta Apparels Pvt Ltd,INDIA,Gujarat, 395315 , Surat,"No : 364, Near Anubha Industries, Nh No 8, Palsana",True,False,False,False,False,False,False,True,True,98.0,2.0,,False,,,,,,1,500
"Guangdong Laigesi Industrial Co., Ltd.",E-Teen Company Limited,CHINA,Guangdong, 522000 , Jieyang,"The Middle Of The Longxing Road, Economic Development Zone Of The Jiedong District, Jieyang City Guangdong Province, China",False,False,True,True,False,False,False,False,False,80.0,20.0,42.0,False,,,,l,,501,1500
"Guangzhou Idb Leathter Co., Ltd.","Guangzhou Idb Leather Co.,Ltd",CHINA,Guangdong, 510800 , Guangzhou,"1St Buidling On The Right No67 Qianyi East Road, Shiling Town, Huadu District",False,True,False,True,False,False,False,False,False,10.0,90.0,0.0,False,,,,l,,1,500
Murat Yapi,Ilka Baski Kumas Tekstil San Ve Tic Ltd Sti,TURKEY,Istanbul, 34212 , Istanbul,Merkez Ofisevren Mah. Gülbahar Cad. Gürol Sok. No:3 Kat:4 Güneşli-Bağcilar,True,False,False,False,False,False,False,False,True,,,,False,,,,,,,
Murat Yapi Tekstil San. Ve Tic. A.S.,Ilka Baski Kumas Tekstil San Ve Tic Ltd Sti,TURKEY,Istanbul, 34212 , Istanbul,"15 Temmuz Mah 1468 Sok. 3/41, Bagcilar",True,False,False,False,False,False,True,False,False,50.0,50.0,,False,,,,,,1,500
Guangzhou Romen Knight Leather Co.Ltd,"Wenzhou Loostar Leather Product Co., Ltd",CHINA,Guangdong, 510000 , Guangzhou,"101-1F ,3F And 4F, Building A, No.6 Lianhe Road, Shiling Town, Huadu District,",False,True,False,True,False,False,False,False,False,35.0,65.0,47.0,False,,,,l,,1,500
Nadine Print,Dice For Ready Made Garments,EGYPT,Qalyubia, 13763 , Khanka,Houd Elgabal El Sharky - Factories Road,True,False,False,False,False,False,False,False,True,,,0.0,True,General Union of workers of textiles,,,l,,1,500
"Guangzhou Yijia Leather Co.,Ltd",Wenzhou Union Fashion Co Ltd,CHINA,Guangdong, 510000 , Guangzhou,"No. 3, 3 Lane, Xinlian East Road, Lian Village, Shiling Town, Huadu District, Guangzhou",False,True,False,True,False,False,False,False,False,48.0,52.0,41.0,False,,,,l,,1,500
Nanjing Dongya Textile Printing & Dyeing Co. Ltd,Lavender Garment Ltd,CHINA,Jiangsu, 211511 , Guabuzhen,2# Shuangxiang Road,True,False,False,False,False,False,False,True,True,,,22.0,False,,,,l,,1,500
"Nantong Baotai Textile Co.,Ltd.",Ventdest Garments Co Ltd,CHINA,Jiangsu, 226000 , Nantong,"No 88,Tongjia Rd,Guanyinshan Town",True,False,False,False,False,False,False,True,False,40.0,60.0,,False,,,,,,1,500
Gupta H.C Overseas (I) Pvt Ltd,Gupta H.C Overseas(I) Pvt Ltd,INDIA,Uttar Pradesh, 282007 , Agra,"C-11, Epip, Shastripuram",False,False,True,True,False,False,False,False,False,33.0,67.0,0.0,False,,,,l,SA8000,501,1500
Haining Sunwit Garment Technology Co Ltd,Sunhong Global Investment Limited,CHINA,Zhejiang, 314000 , Jiaxing City,"No.2 Jingxu Road, Xucun Town",True,False,False,True,False,False,False,False,False,30.0,70.0,42.0,False,,,,,,1,500
"Haiyan Sanma Development Co., Ltd",Hutton Global Trading Limited,CHINA,Zhejiang, 314000 , Jiaxing,"Industrial Zone, Tongyuan Town, Haiyan County",True,False,False,True,False,False,False,False,False,55.0,45.0,0.0,False,,,,l,,501,1500
Hangzhou Deyuan Textiles Co Ltd,Italian Woollen Treasures Srl,CHINA,Zhejiang, 311500 , Tonglu,No. 211 Xihuan Road,False,True,False,True,False,False,False,False,False,66.0,34.0,,False,,,,,,1,500
"Hangzhou Fuyang Ji Ya Shoes Co.,Ltd.",Xiamen Ocean Imp&Exp Development Co Ltd,CHINA,Zhejiang, 310003 , Hangzhou City,"No.67, Huangniqiaotou Road, Yongqiao, Yongchang Village, Yongchang Town, Fuyang District",False,False,True,True,False,False,False,False,False,68.0,32.0,0.0,False,,,,,,1,500
"Hangzhou Huayu Footwear Manufacturing Co., Ltd.",Xiamen Ocean Imp&Exp Development Co Ltd,CHINA,Zhejiang, 310000 , Hangzhou,"No.983, Xiejia Village, Puyang Town, Xiaoshan District, Hangzhou City, Zhejiang Sheng, China",False,False,True,True,False,False,False,False,False,26.0,74.0,11.0,False,,l,100.0,l,,1,500
Nil Orme,Nil Orme Sanay I Ve Ticaret As,TURKEY,Tekirdag, 59880 , Tekirdag,"Velimese, Velimese Yolu, Corlu",True,False,False,False,False,False,False,True,False,,,,False,,,,,,,
Nil Orme (Wet),Nil Orme Sanay I Ve Ticaret As,TURKEY,Istanbul, 34310 , Istanbul,"Cihangir, Sht. Zafer Sk. No:7, 34310 Beylikduzu Osb, Avcilar",True,False,False,False,False,False,False,False,True,,,,False,,,,,,,
"Ningbo Huafu Donghao Industrial Co., Ltd.",Alpi (Hong Kong) International Company Limited.,CHINA,Zhejiang, 312300 , Shaoxing,"Road No 1088, Development District,Shangyu City",True,False,False,False,False,False,True,False,False,76.0,24.0,,False,,,,,,1,500
Nisa Boyahane Bobin Ltd. Sti,Pergamon Status Dis Ticaret As,TURKEY,Denizli, 20000 , Denizli,"Osb Mahallesi, Nevzat Koru Caddesi No:34",True,False,False,False,False,False,False,False,True,50.0,50.0,,False,,,,,,1,500
Hay-Tex Sa,Benetton Industrielle Tunisie Sarl,TUNISIA,Gafsa, 2100 , Gafsa,Cite Ennour,True,False,False,True,False,False,False,False,False,5.0,95.0,0.0,False,,l,100.0,,,1,500
Hektur Hekimoglu Turz.Tic.Ve San. A.S.,Riso Tarim Ve Tekstil Urunleri A.S.,TURKEY,Konya, 42250 , Konya,Buyukkayacik Osb Mah. 8 Nolu Sok. No:24/1 Selcuklu,False,True,False,True,False,False,False,False,False,55.0,45.0,0.0,False,,,,l,GOTS; OCS; ,1,500
Nsl Textiles- Guntur,Lavender Garment Ltd,INDIA,Andhra Pradesh, 522311 , Guntur,"371-382, Chirukapalli Mandal, Kunchalvaripalem Village",True,False,False,False,False,False,False,True,True,78.0,22.0,,False,,,,,,501,1500
Nsl Textiles Ltd.,Lavender Garment Ltd,INDIA,Andhra Pradesh, 523167 , Inkollu,"Inkollu-523167, Prakasam District",True,False,False,False,False,False,False,True,False,,,,False,,,,,,1,500
Huidong Jilong Rongle Shoes Factory,Fly Srl,CHINA,Guangdong, 516000 ," Jilong Town, Huidong, Huizhou City","No. 15, 4Th Road, Jinhua",False,False,True,True,False,False,False,False,False,40.0,60.0,,False,,,,,,1,500
"Huidong Yihuilong Shoes Co., Ltd.",E-Teen Company Limited,CHINA,Guangdong, 516000 , Huizhou,"Huancheng Road, Huangbu Town, Huidong County,",False,False,True,True,False,False,False,False,False,51.0,49.0,0.0,False,,,,l,,1,500
Ibtitex Sarl,Miroglio Textile S.R.L,MOROCCO,Fes, 30000 , Fes,"Lot 1 Qi Sidi Brahim Ii,",True,False,False,True,False,False,False,False,False,13.0,87.0,0.0,False,,,,l,,1,500
Nuryildiz Tekstil Sanayi Ve Ticaret A.S.,Nuryildiz Tekstil Sanay Ve Tic As,TURKEY,Tekirdag, 59850 , Tekirdag,"Velimese Osb, 6. Yanyol Cad. No:46/1, Ergene",True,False,False,False,False,False,True,True,True,35.0,65.0,,False,,,,,,1,500
Ics.Tricot-Cuatro-F S.R.L.,Benetton Tekstil D.O.O.,MOLDAVIA,Gagauzia, Md5301 , Vulcanesti,"Str. Ion Creanga, 3",True,False,False,True,True,False,False,False,True,10.0,90.0,,False,,,,,,1,500
Olimpias Group Srl,Olimpias Group Srl,ITALY,Prato, 59100 , Prato,"Via Del Lazzeretto, 180",True,False,False,False,False,False,True,False,False,,,,False,,,,,,1,500
Id Exports,Italian Woollen Treasures Srl,INDIA,Uttar Pradesh, 201301 , Noida,"D-78, Sector 6",False,True,False,True,False,False,False,False,False,63.0,37.0,36.0,False,,,,l,,1,500
Il Cappello Srl,Il Cappello Srl Ind.Italiana Del Copricap Societa' Unipersonale,ITALY,Fermo, 63020 , Montappone,"Via San Salvatore, 19",False,True,False,True,False,False,False,False,False,36.0,64.0,,False,,,,,,1,500
Ilok Tekstil D.O.O.,Benetton Tekstil D.O.O.,CROATIA,Vukovar, 32236 , Ilok,"Dr. Franje Tudmana, 4",True,False,False,True,False,False,False,False,False,25.0,75.0,0.0,False,,,,,,1,500
Isabela D.O.O.,Benetton Tekstil D.O.O.,CROATIA,Bjelovar, 43290 , Grubisno Polje,"Ulica Kralja Zvonimira, 75",True,False,False,True,False,False,False,False,False,23.0,77.0,0.0,False,,,,,,1,500
Orteks Tekstil,Giza Spinning And Weaving Co,TURKEY,Istanbul, 34325 , Istanbul,Firuzkoy Mahallesi Baglarici Caddesi No. 115Pk 34325 Avcilar,True,False,False,False,False,False,False,True,False,,,,False,,,,,,1,500
Orteks Tekstil Urunleri Sanayi Ve Ticaret A.S.,Ilka Baski Kumas Tekstil San Ve Tic Ltd Sti,TURKEY,Nigde, 51200 , Fertek,"Osb. 2.Cad. Cumhuriyet Osb Mevkii No:4, Merkez",True,False,False,False,False,False,True,False,False,50.0,50.0,,False,,,,,,1,500
Jeb S.N.C. Di Genovese Michele & C.,Jeb S.N.C. Di Genovese Michele & C.,ITALY,Treviso, 31040 , Giavera Del Montello,"Via Pra' Della Valle, 24",True,False,False,True,False,False,False,False,False,50.0,50.0,,False,,,,,,1,500
Ozen Mensucat Boya Ve Terbite Islemeleri A.S. (Taha Group) (Ozen),Ozen Mensucat Boya Terbiye Isletmeleri As,TURKEY,Tekirdag, 59500 , Tekirdag,Cerkezkoy Osb Karaagac Mah. 13 Sk. No.:6,True,False,False,False,False,False,True,True,True,,,,False,,,,,,1,500
Palben Tur Mak Tek Ins Isl Yat  San Ve Tic Ltd Sti,Isil Tekstil San Ve Tic Ltd Sti,TURKEY,Tekirdag, 59510 , Tekirdag,Cerkezkoy Osb Ataturk Mah Cumhuriyet Cad No 51,True,False,False,False,False,False,False,False,True,75.0,25.0,,False,,,,,,1,500
Jiangsu Desheng Clothing Co. Ltd,"Jiangsu Guotai Huasheng Industrial Co.,Ltd",CHINA,Jiangsu, 214500 , Jingjiang City,"Building 9, Desheng Avenue, Xinqiao Town, Jingjiang City, Taizhou City",True,False,False,True,False,False,False,False,False,20.0,80.0,0.0,False,,,,l,,1,500
"Jiangsu Joyous Garments Co., Ltd.",Focus Development Limited,CHINA,Jiangsu, 223000 , Huaian City,"South Side Of Qianjiang Road,Huaiyin District",True,False,False,True,False,False,False,False,False,10.0,90.0,0.0,False,,,,l,,1,500
Panorama Washing Co. Ltd,The Rose Dresses Ltd,BANGLADESH,Dhaka, 1702 , Gazipur,"Kodda Nandun, Nawzor",True,False,False,False,False,False,False,False,True,98.0,2.0,100.0,False,,,,l,,1,500
Paramount Textile Ltd.,Hutton Global Trading Limited,BANGLADESH,Dhaka, 1740 , Gazipur,"Gilarchala, Sreepur",True,False,False,False,False,False,False,True,True,91.0,9.0,91.0,False,,,,l,,3001,5000
"Jiaxing Yongsheng Garment Co.,Ltd","Win-Light Textile Co.,Ltd",CHINA,Zhejiang, 314000 , Jiaxing,"Qijiaji Downtown, Haiyan",True,False,False,True,False,False,False,False,False,47.0,53.0,0.0,False,,,,l,,1,500
Parvathi Dyeing,Shahi Exports Pvt Ltd,INDIA,Tamil Nadu, 641605 , Tirupur,"Sf No - 223, Kunnakal Palayam, Palladam Road, Veerapadi Po.",True,False,False,False,False,False,False,True,True,80.0,20.0,,False,,,,,,1,500
Pettinatura Lagopolane Sas,Pettinatura Lagopolane Sas,ITALY,Prato, 59100 , Prato,Via Gora Del Pero 2,True,False,False,False,False,False,True,False,False,,,,False,,,,,,1,500
Pinori Filati S.P.A.,Pinori Filati S.P.A.,ITALY,Prato, 59100 , Prato,"Via Eugenio Gestri, 19",True,False,False,False,False,False,True,False,False,,,,False,,,,,,,
Pioneer Denim Limited,S.F Denim Apparels Ltd,BANGLADESH,Sylhet, 3333 , Habiganj,"Horitola, Shapur Bazar, Madhobpur, Hobigonj.",True,False,False,False,False,False,False,True,True,98.0,2.0,60.0,False,,,,l,GOTS; ISO 14001; ISO 45001; ISO 9001; OCS     ,1501,3000
"Jieyang City Huaxiang Shoes Industry Co.,Ltd",Xiamen Ocean Imp&Exp Development Co Ltd,CHINA,Guangdong, 522000 , Jieyang,"Zihui Industrial Zone, Xianqiao, Rongcheng District",False,False,True,True,False,False,False,False,False,35.0,65.0,26.0,False,,,,,,1,500
"Jinjiang Fuyu Shoes Co., Ltd.",Xiamen Ocean Imp&Exp Development Co Ltd,CHINA,Fujian, 362200 , Jinjiang,"No.208, Licuo, Dongcun Village, Neikeng Town, Jinjiang City, Fujian Province",False,False,True,True,False,False,False,False,False,53.0,47.0,37.0,False,,,,,,1,500
Printing Seregraphie Textile Sarl,Benetton Industrielle Tunisie Sarl,TUNISIA,Sousse, 4030 , Enfidha,Zone Industrielle Enfidha,True,False,False,False,False,True,False,False,False,7.0,93.0,0.0,False,,l,100.0,,,1,500
Printmi Di Milanese A. & C. S.A.S.,Printmi Di Milanese A. & C. S.A.S.,ITALY,Treviso, 31038 , Padernello Di Paese,"Via Castellana, 3/B",True,False,False,False,False,True,False,False,False,50.0,50.0,,False,,,,,,1,500
Progetto S.R.L.,Progetto S.R.L.,ITALY,Treviso, 31010 , Maser,"Via Canova, 19",True,False,False,False,False,True,False,False,False,50.0,50.0,,False,,,,,,1,500
Prosperity Textile Mmf,S.F. Fashion Wears Ltd,CHINA,Guangdong, 510630 , Guangzhou,"24/F, Tower A, Poly Universe Plaza, 626 Tianhe Nord Road",True,False,False,False,False,False,False,True,False,38.0,62.0,,False,,,,,,1,500
Prosperity Textile-Mmf-Wea-Wpm.,Tarasima Apparels Ltd,CHINA,Hong Kong, 999077 , Hong Kong,"Block G&H, 21/F, Superluck Industrial Centre (Phase 2) , 57 Sha Tsui Road, Tsuen Wan",True,False,False,False,False,False,False,True,False,,,,False,,,,,,1,500
"Jinjiang Lubu Shoes Industry Co., Ltd.",Xiamen Ocean Imp&Exp Development Co Ltd,CHINA,Fujian, 362000 , Quanzhou,"Liupu Industry Zone, Yangdailin, Chendai Town, Jinjiang City",False,False,True,True,False,False,False,False,False,58.0,42.0,48.0,False,,,,l,,1,500
Kaynak Tekstile,Cemsel Tekstil Sanayi Ve Tic .A.S,TURKEY,Denizli, 20065 , Gurlek -Denizli,Organize Sanayi Bolgesi Bitisigi ,True,False,False,True,False,False,False,False,False,40.0,60.0,0.0,False,,,,l,,1,500
Qingshi Textile,Ha Hae Corporation,CHINA,Jiangsu, 223800 , Suqian,Siyang Economic Development Zone,True,False,False,False,False,False,False,True,False,65.0,35.0,,False,,,,,,501,1500
Khadija Aiicha Textile,Benetton Industrielle Tunisie Sarl,TUNISIA,Kasserine, 1214 , Kasserine,Rue Dardour Mejel Ben Abess,True,False,False,True,False,False,False,False,False,7.0,93.0,0.0,False,,l,100.0,l,,1,500
Quan Zhou Shi Gang Jin Machine Embroidery Co. Ltd,South Asia Enterprises Ltd,CHINA,Fujian, 362000 , Quanzhou,"Dong Xi Village, Jintao Town, Nanan Country",True,False,False,False,True,False,False,False,False,50.0,50.0,,False,,,,,,1,500
Quanzhou Gang Jin Dian Nao Ji Xiu You Xian Gong Si,South Asia Enterprises Ltd,CHINA,Fujian, 362307 , Fujian,Fujian Sheng Nanan Shi Jin Tao Zhen Dong Xi Cun,True,False,False,False,True,False,False,False,False,,,,False,,,,,,1,500
"Quanzhou Nanxin Bleach Dye Co., Ltd.",South Asia Enterprises Ltd,CHINA,Fujian, 362000 , Quanzhou,"Chengzhou Industry Area, Quanxiu Road, Fengze District",True,False,False,False,False,False,True,False,True,70.0,30.0,0.0,True,Quanzhou Nanxin Bleach Dye Co Ltd union,l,100.0,,     ,1,500
Krishna Beads Industries Llp,Krishna Beads Industries Llp,INDIA,Uttar Pradesh, 201301 , Noida,C-7 Sector 63,False,True,False,True,False,False,False,False,False,90.0,10.0,13.0,False,,,,l,SMETA; OEKO-TEX; GOTS   ,1,500
R. Belda Llorens Sa Sociedad Unipersonal,Industria Italiana Filati S.P.A.,SPAIN,Alicante, 03450 , Banyeres De Mariola,Partida Campo Oro,True,False,False,False,False,False,True,False,True,,,,False,,,,,,1,500
R.S.Printfab Pvt Ltd,Radnik Exports,INDIA,Uttar Pradesh, 201306 , Noida,"C- 7, Site – C, Surajpur Indl Area Grater Noida",True,False,False,False,False,False,False,False,True,99.0,1.0,,False,,,,,,1,500
Raagam Exports,C.R.Garments,INDIA,Tamil Nadu, 641606 , Tirupur,"S.F.N0.252 Kangayam Main Road,Nallur",True,False,False,False,True,False,False,False,False,75.0,25.0,,False,,,,,,1,500
Radici Yarn Spa,Carvico Spa,ITALY,Bergamo, 24020 , Villa D'Ogna,Via Provinciale 1125,True,False,False,False,False,False,True,False,False,,,,False,,,,,,1,500
La Gimor Snc,La Gimor Snc,ITALY,Treviso, 31044 , Montebelluna,"Via L. Spallanzani, 7",True,False,False,True,False,False,False,False,False,70.0,30.0,,False,,,,,,1,500
Laba D.O.O.,Benetton Tekstil D.O.O.,CROATIA,Vukovar, 32000 , Vukovar Hrvatska,Branka Radicevica Bb,True,False,False,True,True,True,False,True,False,57.0,43.0,0.0,False,,,,l,,1,500
Laba Pro D.O.O.,Benetton Tekstil D.O.O.,CROATIA,Vukovar, 32000 , Vukovar,"Branka Radicevica, 6",True,False,False,True,False,False,False,False,False,6.0,94.0,0.0,False,,,,l,,1,500
Re.Ma. Carding S.R.L.,Texapel S.P.A.,ITALY,Prato, 59100 , Prato,"Via Francesco Frediani, 51/2",True,False,False,False,False,False,True,False,False,50.0,50.0,,False,,,,,,1,500
Retrafil S.N.C.,Cofil S.R.L.,ITALY,Pistoia, 51037 , Montale,Via Guido Rossa 45/L,True,False,False,False,False,False,False,False,True,,,,False,,,,,,1,500
Riart S.R.L.,Riart S.R.L.,ITALY,Treviso, 31040 , Volpago Del Montello,"Via Luigi Pastro, 128/A",True,False,False,False,True,False,False,False,False,50.0,50.0,,False,,,,,,1,500
Ricamificio C.Canziani S.P.A.,Ricamificio C.Canziani Spa,ITALY,Varese, 21013 , Gallarate,"Via Arconti, 4",True,False,False,False,False,False,False,True,False,,,,False,,,,,,,
Laila Styles Ltd,Laila Styles Ltd,BANGLADESH,Dhaka, 1703 , Gazipur,"Bahadurpur, Sikderbari, Gazipur Sadar",True,False,False,True,False,False,False,False,False,27.0,73.0,0.0,False,,,,l,SMETA; WRAP,5000,
Rico China Ltd,Tarasima Apparels Ltd,CHINA,Hong Kong, 999077 , Hong Kong,"Unit 1214 Elite Industrial Centre, 883 Cheung Sha Wan Road, Kowloon",True,False,False,False,False,False,False,True,False,30.0,70.0,,False,,,,,,1,500
Laizhou Lif Arts & Crafts Co,Multibiz Limited,CHINA,Shandong, 261400 , Laizhou,Balamiao Town,False,True,False,True,False,False,False,False,False,10.0,90.0,0.0,False,,,,l,,1,500
Risatel - Sociedade Comercial De Fios Texteis Lda,Sidonios Malhas S.A.,PORTUGAL,Braga, 4800-000 , Guimaraes,R. De Vilar 675,True,False,False,False,False,False,True,False,False,50.0,50.0,,False,,,,,,1,500
Ritorcitura Benedetti Franco S.R.L.,Millefili Spa,ITALY,Prato, 59013 , Montemurlo,"Via Michelangelo, 20/22",True,False,False,False,False,False,True,False,False,,,,False,,,,,,1,500
Ritorcitura Grazia Sas,Millefili Spa,ITALY,Prato, 59013 , Montemurlo,Via Pisano 10/14,True,False,False,False,False,False,True,False,False,,,,False,,,,,,1,500
Ritorcitura Luis Di Qoku,Cofil S.R.L.,ITALY,Prato, 59013 , Montemurlo,"Via Dell'Artigianato, 13",True,False,False,False,False,False,True,False,False,,,,False,,,,,,1,500
Ritorcitura Nenciarini Di Nenciarini Fabrizio E C. Snc,Pettinatura Lagopolane Sas,ITALY,Prato, 59100 , Prato,Via Nuova 8,True,False,False,False,False,False,True,False,False,,,,False,,,,,,1,500
Ritorcitura Parisa S.R.L.,Cofil S.R.L.,ITALY,Prato, 59013 , Montemurlo,"Via A. Pisano, 22/24",True,False,False,False,False,False,True,False,False,,,,False,,,,,,1,500
Romans Ricami S.A.S.,Romans Ricami S.A.S.,ITALY,Treviso, 31012 , Cappella Maggiore,"Via Mescolino, 6/A",True,False,False,False,True,False,False,False,False,50.0,50.0,,False,,,,,,1,500
Larimode S.A.R.L Au,Platform And Design,MOROCCO,Tangier-Assilah, 90000 , Tangier,"Lot 847, Zone Industrielle Al Majd",True,False,False,True,False,False,False,False,False,40.0,60.0,0.0,False,,,,l,,1,500
Larinconf Sarl,Platform And Design,MOROCCO,Tangier-Assilah, 90000 , Tangier,Zone Industriel Route De Tetouan Lot 11 Alle 1,True,False,False,True,False,False,False,False,False,40.0,60.0,,False,,,,,,1,500
Ruian Far East International Trade Co Ltd,Ellea Srl,CHINA,Zhejiang, 325200 , Ruian,"Huabaio Village, North Industrial Zone Of Xincheng Country",True,False,False,False,False,False,True,False,False,50.0,50.0,,False,,,,,,1,500
Lavastir Service Srl,Lavastir Service Srl,ITALY,Treviso, 31020 , Villorba,"Via Amendola, 9",True,False,False,True,False,False,False,False,False,10.0,90.0,,False,,,,,,1,500
S.E.T. S.P.A. (Società Europa Tessile),Miroglio Textile S.R.L,ITALY,Roma, 00065 , Fiano Romano,"Via Dell'Agricoltura,  18",True,False,False,False,False,False,False,True,True,,,,False,,,,,,1,500
Lavender Garment Ltd,Lavender Garment Ltd,BANGLADESH,Dhaka, 1720 , Gazipur,"Mouza-Itahata, Cs-249, Rs-268, Digirchala, Chandana Chowrasta",True,False,False,True,False,False,False,False,False,42.0,58.0,0.0,False,,,,,GOTS; BSCI,501,1500
Lavender Garment Ltd.,Hutton Global Trading Limited,BANGLADESH,Dhaka, 1750 , Gazipur,"Kamrangachala, Mouchak. Thana Kaliakair",True,False,False,True,False,False,False,False,False,30.0,70.0,44.0,False,,,,,GOTS; BSCI,501,1500
Lemie Spa,Lemie Spa,ITALY,Bergamo, 24049 , Verdello,"Via Camozzi, 2",False,True,False,True,False,False,False,False,False,21.0,79.0,0.0,True,Unknown,l,100.0,l,,1,500
Leonarda D.O.O.,Benetton Tekstil D.O.O.,CROATIA,Bjelovar, 43500 , Daruvar,"Nikole Subica Rinskog, 26",True,False,False,True,False,False,False,False,False,4.0,96.0,0.0,False,,,,l,,1,500
Sanjana Fabrics Limited,Tarasima Apparels Ltd,BANGLADESH,Dhaka, 1400 , Narayanganj,"Mahona,Duptara,Rupganj,Narayanganj",True,False,False,False,False,False,False,True,True,93.0,7.0,60.0,False,,,,l,,501,1500
Sanko Tekstil Industries (Holding),Aktek Giyim San Ve Tic A.S.,TURKEY,Gaziantep, 27580 , Sehitkamil,"Sanko Holding Burak Mah, Sani Konukoglu Bulvari, No:223",True,False,False,False,False,False,True,False,False,87.0,13.0,,True,Unknown,l,100.0,l,GOTS,501,1500
Linatex-Plus Sarl,Benetton Industrielle Tunisie Sarl,TUNISIA,Mahdia, 5180 , Ksour Essef,Rue Elhamam,True,False,False,True,False,False,False,False,False,4.0,96.0,0.0,False,,l,100.0,l,,1,500
Sarla Fabric Ltd,Shahi Exports Pvt Ltd.,INDIA,Uttar Pradesh, 201005 , Ghaziabad,"Plot No –30, Loni Road  Mohan Nagar",True,False,False,False,False,False,False,True,True,99.0,1.0,,False,,,,,,501,1500
"Lishui Xuyang Shoes Co., Ltd.,","Quanzhou Skysun Science And Technology Co., Ltd.",CHINA,Zhejiang, 32300 , Lishui City,"No.97 Yunjing Road, Nanmingshan Street, Liandu Area",False,False,True,True,False,False,False,False,False,40.0,60.0,46.0,False,,,,,,1,500
L'Ocean Confection,Benetton Industrielle Tunisie Sarl,TUNISIA,Monastir, 5050 , Monastir,Rue Ali El Houssi,True,False,False,True,False,False,False,False,False,4.0,96.0,0.0,False,,l,100.0,,,1,500
Makna-Textile,Benetton Industrielle Tunisie Sarl,TUNISIA,Monastir, 5050 , Moknine,Rue Abou Firass Alhamdani,True,False,False,True,False,False,False,False,False,4.0,96.0,0.0,False,,l,98.0,l,,1,500
Mare Konfekcija D.O.O.,Benetton Tekstil D.O.O.,CROATIA,Vukovar, 32000 , Vukovar Hrvatska,Branka Radicevica Bb,True,False,False,True,False,False,False,False,False,0.0,100.0,0.0,False,,,,l,,1,500
Selcuk Iplik As,Filartex Spa,TURKEY,Gaziantep, 27600 , Gaziantep,"2. Osb 83221, Nolu Cd No:6, Sehitkamil",True,False,False,False,False,False,True,False,False,97.0,3.0,,False,,,,,,1501,3000
Sericam Tunisia Sarl,Benetton Industrielle Tunisie Sarl,TUNISIA,Manouba, 2010 , Manouba,Rue Hamouda Bacha  Z.I. Ksar Saiid,True,False,False,False,True,True,False,False,False,11.0,89.0,0.0,False,,l,100.0,,,1,500
Settavex S.A.,Tavex Europe Sl,MOROCCO,Settat, 26000 , Settat,"Zone Industrialle Settat, Bp 668 Settat",True,False,False,False,False,False,True,True,True,94.0,6.0,,False,,,,,,501,1500
Marna-Tex Sa,Benetton Industrielle Tunisie Sarl,TUNISIA,Gafsa, 2100 , Gafsa,Cite Aeroport Gafsa,True,False,False,True,False,False,False,False,False,9.0,91.0,0.0,False,,l,100.0,,,1,500
Severi E Gavioli S.R.L.,Cofil S.R.L.,ITALY,Modena, 41012 , Carpi,"Via Napoli, 2",True,False,False,False,False,False,False,False,True,50.0,50.0,,False,,,,,,1,500
Sf Washing Ltd,S.F Denim Apparels Ltd.,BANGLADESH,Dhaka, 1430 , Narayangonj,"Nayabari, Kanchpur, Sonargaon",True,False,False,False,False,False,False,False,True,72.0,28.0,57.0,False,,,,l, GOTS; GRS; OCS; RCS ,501,1500
Mascotex Ltd,Mascotex Limited,BANGLADESH,Dhaka, 1230 , Gazipur,"31-32 Mannan Mension Shataish, Tongi",True,False,False,True,False,False,False,False,False,30.0,70.0,0.0,False,,,,l,,1501,3000
Shahi 7 (Sos) - Shahi Exports Pvt Ltd,Shahi Exports Pvt Ltd.,INDIA,Karnataka, 560102 , Bangalore,"Survey No 13-15, Bellandur Gate, Sarjapur Rd",True,False,False,False,True,False,False,False,False,59.0,41.0,,False,,,,,,3001,5000
Mb Confezioni S.R.L.,Mb Confezioni S.R.L.,ITALY,Venezia, 30010 , Campolongo Maggiore,"Via Piera, 3",True,False,False,True,False,False,False,False,False,20.0,80.0,,False,,,,,,1,500
