COMPANY NAME,VENDOR,COUNTRY,COUNTY,ZIP,CITY,STREET,APPAREL,ACCESSORIES,SHOES,MANUFACTURING,OTHER_PROCESSING,PRINTING,SPINNING,WEAVING,WET_PROCESS,% MEN,% WOMEN,% MIGRANT WORKERS,TRADE UNION,NAME OF THE TRADE UNION,COLLECTIVE BARGAINING AGREEMENT,% WORKFORCE COVERED BY THE CBA,WORKERS' REPRESENTATIVES,CERTIFICATIONS,MIN_EMPLOYEES,MAX_EMPLOYEES
4P Empirme San. Ve Tic.Ltd.Sti.,Global Sourcing Dis Tic A.S,TURKEY,Istanbul, 34209 , Istanbul,"Mimar Sinan Cd No:9, Baglar Mahallesi, Bagcilar",True,False,False,False,False,True,False,False,False,,,,False,,,,,,1,500
A To Z Cotton Centre,C.R.Garments,INDIA,Tamil Nadu, 641602 , Tirupur,"Miller Bus Stop, 414, Pn Rd, Vengamedu, Poyampalayam",True,False,False,False,False,False,False,True,False,70.0,30.0,,False,,,,,,1,500
Aarti International Limited,Shahi Exports Pvt Ltd.,INDIA,Punjab, 141113 , Ludhiana,"Vill. Bhama Kalan & Harhian , P . O . Uppal , Kohara Machiwara  Road",True,False,False,False,False,False,False,True,True,97.0,3.0,,False,,,,,,501,1500
Aba Tekstil Orme San Ve Tic A.S.,Aba Tekstil Orme San Ve Tic As,TURKEY,Istanbul, 34180 , Instanbul,Merkez Mah. Prof Dr Nevzat Pisak Cad. No19 Yenibosna Bahcelievler,True,False,False,False,False,False,True,True,False,50.0,50.0,,False,,,,,,1,500
"Ac International Co., Ltd",Demka Tekstil San Ve Tic As,CHINA,Guangdong, 510000 , Guangzhou,"Room 1330, Yuemin Building, 114 Xingang West Road, Haizhu District",True,False,False,False,False,False,False,True,False,100.0,0.0,,False,,,,,,1,500
Acar Ihracat Ithalat Tekstil Tic. Ve San A.S,Miroglio Textile S.R.L,TURKEY,Bursa, 16000 , Bursa,"Demirtas Osb Cigdem 1. Sok. No: 23, Osmangazi",True,False,False,False,False,False,False,True,False,10.0,90.0,,False,,,,,,1,500
Cta Apparels Unit-Sect. 63,Cta Apparels Pvt Ltd,INDIA,Uttar Pradesh, 201309 , Noida,No.23 Harbin Road Dda,True,False,False,True,True,False,False,False,False,,,,False,,,,,,1,500
New Marco'S S.R.L.,New Marco'S S.R.L.,ITALY,Treviso, 31020 , Villorba,"Via Xxv Aprile, 4",True,False,False,True,True,False,False,False,False,15.0,85.0,,False,,,,,,1,500
Okiello S.R.L.,Okiello S.R.L.,ITALY,Padova, 35019 , Tombolo,"Via Mantegna, 24",True,False,False,True,False,False,False,True,False,28.0,72.0,,False,,,,,,1,500
Shahi Exports Pvt Ltd,Shahi Exports Pvt Ltd,INDIA,Karnataka, 560076 , Bangalore,"37/1B,43/2, 43/3 Arekere, Bannerghatta Main Road",True,False,False,True,True,True,False,False,False,34.0,66.0,,False,,,,l,,5000,
Akin Tekstil A.S,Aktek Giyim San Ve Tic A.S.,TURKEY,Kirklareli, 39750 , Kirklareli,Arapcatagi Mevki Evrensekiz Koyu Luleburgaz,True,False,False,False,False,False,False,False,True,66.0,34.0,0.0,True,TURK-IS,l,100.0,,EUROPEAN FLAX; ISO 14001; ISO 27001; OEKO-TEX ,501,1500
Shahi Exports Pvt Ltd,Shahi Exports Pvt Ltd,INDIA,Karnataka, 560058 , Bangalore,"No 226/227, 8Th Main, 3Rd Phase, K.I.A.D.B. Peenya Industrial Area",True,False,False,True,True,False,False,False,False,24.0,76.0,,False,,,,l,GOTS; GRS     ,1501,3000
Akkus Tekstil San Dis Tic As,Akkus Tekstil San Dis Tic As,TURKEY,Istanbul, 34310 , Avcilar,Cihangir Mah. Sehit Piyade Er Yavuz Bahar Sok. No.19,True,False,False,False,False,False,False,False,True,7.0,93.0,0.0,False,,,,,     ,1,500
Societe Star Serigraphie Sarl,Benetton Industrielle Tunisie Sarl,TUNISIA,Gafsa, 2100 , Gafsa,Zone Industrielle Elaguila,True,False,False,True,False,True,False,False,False,9.0,91.0,0.0,False,,l,100.0,,,1,500
Akurun Tekstil Tarim Gida San. Tic. A.S.,Pergamon Status Dis Ticaret As,TURKEY,Denizli, 20330 , Denizli,Organize Sanayi Bolgesi Servergazi Caddesi No:5 Honaz,True,False,False,False,False,False,False,False,True,,,,False,,,,,,1,500
Societe Suffeitula Confection Sarl,Benetton Industrielle Tunisie Sarl,TUNISIA,Kasserine, 1200 , Sbeitla,Rue De L'Ecole Agricole,True,False,False,True,False,False,False,False,False,9.0,91.0,0.0,False,,l,100.0,,,1,500
Societe Wafatextozeur,Benetton Industrielle Tunisie Sarl,TUNISIA,Gafsa, 2130 , Gafsa,Pepiniere Des Entreprise A Cote Insat Route Nefta,True,False,False,True,False,False,False,False,False,12.0,88.0,0.0,False,,l,100.0,,     ,1,500
Almodo Altunlar Tekstil,Platform And Design,TURKEY,Tekirdag, 59520 , Tekirdag,Karaagac Mah. 6. Sk. No:5 Kapakli,True,False,False,False,False,False,False,True,True,62.0,38.0,,False,,,,,,501,1500
Alpes Manifattura Filati Spa,Alpes Manifattura Filati Spa,ITALY,Vicenza, 36028 , Rossano Veneto,"Via Salute, 52",True,False,False,False,False,False,True,False,False,,,,False,,,,,,,
"Alroubaia Fourtex Textiles Co‏,‏‎ S.A.E (3Rd)",T&C Garments S.A.E,EGYPT,Monufia, 32897 , Sadat City,3Rd Industrial Zone Extension,True,False,False,False,False,False,False,True,True,97.0,3.0,,False,,,,,,3001,5000
Amber Denim Ltd,Sterling Apparels Ltd.,BANGLADESH,Dhaka, 1703 , Dhaka,"Jangaliapara, Banglabazar, Post Office- Mirzapur, Joydebpur",True,False,False,False,False,False,True,True,True,,,93.0,False,,,,,GOTS; GRS; OCS; RCS ,1,500
Sozak Creation Sarl,Benetton Industrielle Tunisie Sarl,TUNISIA,Monastir, 5031 , Ksibet El Mediouni,Route De M'Saken,True,False,False,True,False,False,False,False,False,16.0,84.0,0.0,False,,l,100.0,l,,1,500
Ste' Abi-Tex,Benetton Industrielle Tunisie Sarl,TUNISIA,Gafsa, 2100 , Gafsa,Cite La Garre - Snad,True,False,False,True,False,False,False,False,False,12.0,88.0,0.0,False,,l,100.0,,,1,500
Anhui Huamao Weaving & Dyeing Co Ltd,Lavender Garment Ltd,CHINA,Anhui, 246001 , Anqing City,"No. 2 Road, Lingang Economic Development Zone, Yingjiang District",True,False,False,False,False,False,False,True,True,,,,False,,,,,,1,500
"Anhui Huatai Textile Co.,Ltd.",Lavender Garment Ltd,CHINA,Anhui, 246001 , Anqing City,"12Th Road, Da Qiao Economic Development Zone",True,False,False,False,False,False,False,True,False,37.0,63.0,,False,,,,,,501,1500
Aquafil Spa,Ricamificio C.Canziani Spa,ITALY,Trento, 38062 , Arco,Via Linfano 9,True,False,False,False,False,False,True,False,False,50.0,50.0,,False,,,,,,1,500
Aquafilslo Lubiana,Jersey Lomellina Spa,SLOVENIA,0, 1000 , Ljubljana,"Letaliska Cesta, 15",True,False,False,False,False,False,True,False,False,,,,False,,,,,,1,500
Ste Afro Tex,Benetton Industrielle Tunisie Sarl,TUNISIA,Gafsa, 2100 , Gafsa,Zone Industrielle Laguila,True,False,False,True,False,True,False,False,False,14.0,86.0,0.0,False,,l,100.0,,,1,500
Arateks San. Tic. A.S.,Aktek Giyim San Ve Tic A.S.,TURKEY,Kahramanmaras, 46100 , Kahramanmaras,"Kilili, No:6, Tanriverdi Cd., Türkoğlu",True,False,False,False,False,False,True,False,True,90.0,10.0,,False,,,,,,1,500
Ste' Ah Creation,Benetton Industrielle Tunisie Sarl,TUNISIA,Monastir, 5050 , Moknine,Cite' Zamrine,True,False,False,True,False,False,False,False,False,9.0,91.0,0.0,False,,l,100.0,,,1,500
Arifoglu Dokuma Tekstil Iplik Paz. San. Ve Tic. A.S.,Ilka Baski Kumas Tekstil San Ve Tic Ltd Sti,TURKEY,Adana, 01350 , Yuregir,Acidere Osb Mah. Zubeyde Hanim Cad. No:2/A,True,False,False,False,False,False,True,False,False,50.0,50.0,,False,,,,,,1,500
Arikan Tekstil,Nuryildiz Tekstil Sanay Ve Tic As,TURKEY,Kahramanmaras, 46100 , Kahramanmaras,Gaziantep Yolu Uzeri Erkenez Mevkii,True,False,False,False,False,False,True,False,False,,,,False,,,,,,1,500
Ste' Amen Confection Sarl,Benetton Industrielle Tunisie Sarl,TUNISIA,Kasserine, 1200 , Kasserine,Zone Ind. Route De Sbeitla,True,False,False,True,False,False,False,False,False,6.0,94.0,0.0,False,,l,100.0,,,1,500
Arsan Dokuma Boya San Ve Tic A.S,Arsan Dokuma Boya San Ve Tic A.S,TURKEY,Kahramanmaras, 46100 , Kahramanmaras,Karacasu Ferhus Mah. Yildirim Bayazit Cad. No: 7/A,True,False,False,False,False,False,True,True,True,94.0,6.0,,False,,,,,,501,1500
Artcolor Srl,Olimpias Group Srl,ITALY,Prato, 59025 , Usella,"Via Bologna, 288",True,False,False,False,False,False,False,False,True,84.0,16.0,,False,,,,,,1,500
Artistic Garment Industries (Agi Denim) (Pvt.) Ltd,Denimach Ltd,PAKISTAN,Sindh, 75530 , Karachi,"Survey 16, 17, Deh Khando Tappo, Landhi Bin Qasim Town",True,False,False,False,False,False,False,True,True,99.0,1.0,0.0,False,,,,l,,501,1500
Ste Awes Confection,Benetton Industrielle Tunisie Sarl,TUNISIA,Gafsa, 2130 , Gafsa,Rue Zouhour Metlawi,True,False,False,True,False,False,False,False,False,14.0,86.0,0.0,False,,l,100.0,,     ,1,500
Arvind Limited - Gandhinagar,Arvind Limited,INDIA,Gujarat, 382721 , Ahmedabad,"Khatraj Chowkdi, Santej, P.O. Vadsar, Taluka : Kalol Dist: Gandhinagar",True,False,False,False,False,False,False,True,True,75.0,25.0,0.0,True,"Majoor Mahajan Sangh (Textile Labor Association, Ahmedabad)",l,84.0,l,GOTS; GRS; ISO 45001;  OCS ,5000,
Ste Ayet Tex,Benetton Industrielle Tunisie Sarl,TUNISIA,Gafsa, 2180 , Gafsa,Rue Des Martyrs El Guetar,True,False,False,True,False,False,False,False,False,12.0,88.0,0.0,False,,l,100.0,,,1,500
Ste' Azienda Manufattura E Servize,Benetton Industrielle Tunisie Sarl,TUNISIA,Gafsa, 2100 , Gafsa,Zone Industrielle Elaguila,True,False,False,True,False,False,False,False,False,29.0,71.0,0.0,False,,l,100.0,,,1,500
Ste' B.S. Textiles,Benetton Industrielle Tunisie Sarl,TUNISIA,Gafsa, 2100 , Gafsa,Cite La Garre Redeyef,True,False,False,True,False,False,False,False,False,4.0,96.0,0.0,False,,l,100.0,,     ,1,500
Ste Best Brand,Benetton Industrielle Tunisie Sarl,TUNISIA,Sousse, 4021 , Kalaa Sghira,Avenue 20 Mars,True,False,False,True,False,False,False,False,False,3.0,97.0,0.0,False,,l,100.0,l,,1,500
Atb,Atb-Acab.Texteis De Barcelos Lda,PORTUGAL,Braga, 4750-571 , Barcelos,Rua Afonso Nunes De Mariz,True,False,False,False,False,False,True,True,True,,,,False,,,,,,1,500
Attire Printing Industries,S.F Denim Apparels Ltd.,BANGLADESH,Dhaka, 1230 , Dhaka,"143, Hayet Ullah Bhuiyan Road, Mollartek",True,False,False,False,False,True,False,False,False,,,,False,,,,,,1,500
Auko-Tex Ltd.,Yasin Knittex Ind. Ltd,BANGLADESH,Dhaka, 1349 , Gaziur,"South Panishail, Zirani Bazar (B.K.S.P).",True,False,False,False,False,False,False,True,False,100.0,0.0,,False,,,,,,1,500
Auro Textiles,Radnik Exports,INDIA,Himachal Pradesh, 173205 , Baddi,"Sai Road, Dist - Solan , Himachal Pradesh",True,False,False,False,False,False,False,True,True,78.0,22.0,,False,,,,,,501,1500
Auro Weaving,Lavender Garment Ltd,INDIA,Himachal Pradesh, 173205 , Baddi,"Sai Road,Baddi(H.P)",True,False,False,False,False,False,False,True,False,74.0,26.0,,False,,,,,,3001,5000
Ayyildiz Tekstil,Akkus Tekstil San Dis Tic As,TURKEY,Tekirdag, 59500 , Cerkezkoy,"15 Temmuz  Mah, Halkali Cad, 1432  Sok No  Gunesli",True,False,False,False,False,False,False,True,True,40.0,60.0,,False,,,,,,1,500
Ste Bha Confection,Benetton Industrielle Tunisie Sarl,TUNISIA,Monastir, 5050 , Monastir,Homet Souiassi,True,False,False,True,False,False,False,False,False,6.0,94.0,0.0,False,,l,88.0,,     ,1,500
"Barceltinge Tinturaria, Lda","Familitex-Tecelagem,Lda",PORTUGAL,Braga, 4754-909 , Barcelos,"Rua Do Rio N 327 Apt. 121, 4754-909 Manhente",True,False,False,False,False,False,False,False,True,90.0,10.0,,False,,,,,,1,500
Ste' Biga-Tex Sa,Benetton Industrielle Tunisie Sarl,TUNISIA,Gafsa, 2100 , Gafsa,Cite Modernres Moulares,True,False,False,True,False,False,False,False,False,6.0,94.0,0.0,False,,l,100.0,,,1,500
Ste' Brodland Sarl,Benetton Industrielle Tunisie Sarl,TUNISIA,Monastir, 5036 , Menzel Harb,Avenue 7 Nouvembre,True,False,False,True,True,True,False,False,False,43.0,57.0,0.0,False,,l,100.0,,,1,500
"Beijing Futai Leather Base Cloth Co., Ltd.",Ventdest Garments Co Ltd,CHINA,Beijing, 101500 , Miyun,"No. 3, Shuangyan Street",True,False,False,False,False,False,False,True,False,49.0,51.0,,False,,,,,,1,500
Besler Tekstil Sanayi Ve Ticaret A.S.,Ilka Baski Kumas Tekstil San Ve Tic Ltd Sti,TURKEY,Kayseri, 38200 , Melikgazi,Org.San.Bol 39. Cad. No: 5,True,False,False,False,False,False,True,False,True,50.0,50.0,,False,,,,,,1,500
Ste' Crea-Tex,Benetton Industrielle Tunisie Sarl,TUNISIA,Gafsa, 2100 , Gafsa,Cite Manzah,True,False,False,True,False,False,False,False,False,3.0,97.0,0.0,False,,l,100.0,,,1,500
Bims Tekstil San. Ve Tic. Ltd Sti,Miroglio Textile S.R.L,TURKEY,Bursa, 16215 , Bursa,"Isiktepe Osb Mah, 75. Yil Blv. No:11, Nilufer",True,False,False,False,False,False,False,True,False,51.0,49.0,,False,,,,,,1,500
Bo Luo Xian Shi Wan Ri Chang Sheng Printing Factory,Pavilion Investment Ltd,CHINA,Guangdong, 516127 , Hui Zhou,"Yong Shi Da Dao, Shi Wan Town, Bo Luo County",True,False,False,False,False,True,False,False,False,33.0,67.0,,False,,,,,,1,500
Borkan Tekstil Sanayi.Tic Ltd.Sti,Akkus Tekstil San Dis Tic As,TURKEY,Istanbul, 34250 , Istanbul,"Yakuplu Mah. Beysan Sanayi Sitesi Dereboyu Cad. Gocmen Sk. No:3, Beylikduzu",True,False,False,False,False,False,False,False,True,86.0,14.0,,False,,,,,,1,500
Bossa Ticaret Ve Sanayi Isletmeleri A.S.,Global Sourcing Dis Tic A.S,TURKEY,Adana, 01790 , Saricam,"Haci Sabanci Osb No:2, Saricam",True,False,False,False,False,False,False,True,False,,,,False,,,,,,1501,3000
Bossa Ticaret Ve Sanayi Isletmeleri Tas,Bossa Ticaret Ve Sanayi Isletmeleri T.A.Ş.,TURKEY,Adana, 01790 , Adana,Haci Sabanci Osb Acidere Mah. Celal Bayar Bul. No:3 Saricam,True,False,False,False,False,False,True,True,True,98.0,2.0,,False,,,,,,501,1500
Ste Creation Et Confection,Benetton Industrielle Tunisie Sarl,TUNISIA,Monastir, 5024 , Menzel Fersi,Rue De Moknine,True,False,False,True,False,False,False,False,False,10.0,90.0,0.0,False,,l,100.0,,,1,500
Boy-Bo Tekstil (Bo Group),Giza Spinning And Weaving Co,TURKEY,Istanbul, 34325 , Istanbul,Osmangazi Mah. 2647 Sok. No:11 34522 Esenyurt,True,False,False,False,False,False,False,False,True,,,,False,,,,,,1,500
"Bozhou Shanshang Textile Technology Co., Ltd.",Pavilion Investment Ltd,CHINA,Anhui, 236800 , Bozhou,"No.20,  Yao Du Road, Qiaocheng District",True,False,False,False,False,False,False,True,True,56.0,44.0,,False,,,,,,1,500
Ste' De Conf Moderne Kasserine Sarl,Benetton Industrielle Tunisie Sarl,TUNISIA,Kasserine, 1200 , Kasserine,Zone Ind. - Cite Khadra,True,False,False,True,False,False,False,False,False,11.0,89.0,0.0,False,,l,100.0,,,1,500
Ste De Confection Ideal Du Sud,Benetton Industrielle Tunisie Sarl,TUNISIA,Sfax, 3063 , Impasse Habbena - Sfax,"Route Sidi Mansour Km 4,5",True,False,False,True,False,False,False,False,False,15.0,85.0,0.0,False,,l,100.0,,,1,500
Ste' Defi Confection Sarl,Benetton Industrielle Tunisie Sarl,TUNISIA,Monastir, 4070 , M'Saken,G.P.1 Route Sousse Messadine,True,False,False,True,False,False,False,False,False,7.0,93.0,0.0,False,,l,96.0,l,,1,500
Ste' Demco Knitwear Sarl,Benetton Industrielle Tunisie Sarl,TUNISIA,Monastir, 5050 , Monastir,Zone Industrielle Moknine,True,False,False,True,False,True,False,False,False,10.0,90.0,,False,,,,,,501,1500
Burteks Tekstil San.Ve Tic. A.S,Bims Tekstil Sanayi Ve Ticaret Ltd Sti,TURKEY,Gaziantep, 27500 , Gaziantep,"Bati 2. Cd. No:2 D:12, Sehitkamil",True,False,False,False,False,False,True,False,False,,,,False,,,,,,1,500
C.R. Garments (Printing & Embroidery Division),C.R.Garments,INDIA,Tamil Nadu, 641605 , Tirupur,"7/385-A, 7/385-B, V.G.V Garden, Chennimalaipalayam, Veerapandi (P.O), Karaipudur Village",True,False,False,False,True,True,False,False,False,80.0,20.0,30.0,False,,,,l,,1,500
Stè Enfavet Inter,Benetton Industrielle Tunisie Sarl,TUNISIA,Monastir, 5024 , Moknine,Boul. De L'Environnement,True,False,False,True,False,False,False,False,False,15.0,85.0,,False,,,,,,1,500
Cak Tekstil San Tic.As.,Konak Tul Perde Sanayii A.S.,TURKEY,Istanbul, 34209 , Bagcilar,Gunesli Mimar Sinan Cad.No.:3,True,False,False,False,False,False,False,False,True,50.0,50.0,,False,,,,,,1,500
Ste Gana Confection,Benetton Industrielle Tunisie Sarl,TUNISIA,Monastir, 5050 , Moknine,Rue Khaled Ibn Walid,True,False,False,True,False,False,False,False,False,10.0,90.0,,False,,,,,,1,500
Ste' Iai Creation Sarl,Benetton Industrielle Tunisie Sarl,TUNISIA,Monastir, 5050 , Moknine,Rue Salah Eddine Ayoubi,True,False,False,True,False,False,False,False,False,6.0,94.0,0.0,False,,l,100.0,,,1,500
Ste' Khalil Tex Sarl,Benetton Industrielle Tunisie Sarl,TUNISIA,Gafsa, 2100 , Gafsa,Elguettar Elgarbia,True,False,False,True,False,False,False,False,False,7.0,93.0,0.0,False,,l,100.0,,,1,500
Carvico S.P.A.,Carvico Spa,ITALY,Bergamo, 24030 , Carvico,"Via Don A. Pedrinelli, 96",True,False,False,False,False,False,False,True,True,30.0,70.0,,False,,,,,,1,500
Ste' Linda Apparel Et Fashion Sarl,Benetton Industrielle Tunisie Sarl,TUNISIA,Kasserine, 1200 , Kasserine,Rue Tahar Bouzrib Cite'Essalem,True,False,False,True,False,False,False,False,False,9.0,91.0,0.0,False,,l,100.0,,,1,500
Ste L'Ocean Coupe,Benetton Industrielle Tunisie Sarl,TUNISIA,Monastir, 5050 , Moknine,Rue Okba Nafea,True,False,False,True,False,False,False,False,False,75.0,25.0,0.0,False,,l,100.0,,     ,1,500
Ste Look Company Sarl,Benetton Industrielle Tunisie Sarl,TUNISIA,Sousse, 4015 , Borjine,Route De Sfax Km 108,True,False,False,True,False,True,False,False,False,14.0,86.0,0.0,False,,l,100.0,,,1,500
"Changshu Dongfang Dyeing And Finishing Co., Ltd","Jiangsu Guotai Huasheng Industrial Co.,Ltd",CHINA,Zhejiang, 215500 , Changshu,"16 Fuchunjiang Road, Guli Town",True,False,False,False,False,False,False,False,True,40.0,60.0,40.0,True,Unknown,,,,,501,1500
"Changshu Yuyang Knitting & Textile Co., Ltd","Jiangsu Guotai Huasheng Industrial Co.,Ltd",CHINA,Jiangsu, 215500 , Changshu,"Shuichang Road, Guli Town",True,False,False,False,False,False,False,True,False,,,,False,,,,,,1,500
Changzhou Hanfa Textile Co,Tarasima Apparels Ltd,CHINA,Jiangsu, 213100 , Changzhou,"South Industrial Park,Ming Huanggou,Wujin District",True,False,False,False,False,False,False,True,False,,,,False,,,,,,1,500
Changzhou Oriental Eastdye Textile Co. Ltd,Lavender Garment Ltd,CHINA,Jiangsu, 213000 , Changzhou,"No. 68 Qingyang North Road, Tianning District",True,False,False,False,False,False,False,False,True,50.0,50.0,32.0,True,All-China Federation of Trade Unions,l,100.0,,EUROPEAN FLAX; GOTS; GRS; OCS; RCS ,1,500
Changzhou Shuangjiachuangxuan Textile Co Ltd,Lavender Garment Ltd,CHINA,Jiangsu, 213000 , Changzhou,78 Wujin Ave West Road,True,False,False,False,False,False,False,True,False,20.0,80.0,,False,,,,,,1,500
"Changzhou Shuangle Textile Product Co., Ltd",Lavender Garment Ltd,CHINA,Jiangsu, 213163 , Changzhou,"No. 12 Xinxing Road, Niutang Textile Industrial Zone Wujin",True,False,False,False,False,False,False,True,False,,,,False,,,,,,1,500
"Changzhou Tintin Textile Co., Ltd","Richland(Liaoning)Int'L Co., Ltd",CHINA,Jiangsu, 213100 , Changzhou,"No 10 Dongxinrd, Niutang",True,False,False,False,False,False,False,True,False,,,,False,,,,,,1,500
"Changzhou Xinguang Printing & Dyeing Co.,Ltd",Tarasima Apparels Ltd,CHINA,Jiangsu, 213000 , Changzhou,"No.28 Fenghuang South Road, Hutang Town, Wujin District",True,False,False,False,False,False,False,False,True,40.0,60.0,,False,,,,,,1,500
"Changzhou Xinhongmei Weaving Co., Ltd","Jiangsu Guotai Huasheng Industrial Co.,Ltd",CHINA,Jiangsu, 213000 , Changzhou,Xinzha Industry Zone,True,False,False,False,False,False,False,True,False,,,,False,,,,,,1,500
Ste' Loujayen Textile,Benetton Industrielle Tunisie Sarl,TUNISIA,Sousse, 4022 , Sousse,Rue De Tunis Oued Iaarouk,True,False,False,True,False,False,False,False,False,27.0,73.0,0.0,False,,l,100.0,,     ,1,500
Ste' Mb Sarl,Benetton Industrielle Tunisie Sarl,TUNISIA,Mahdia, 5140 , Souassi,Zone Ind. Souassi Route El Jem,True,False,False,True,False,False,False,False,False,7.0,93.0,0.0,False,,l,100.0,,,1,500
Cixi Saizhuo Textile Co. Ltd,"Jiangsu Guotai Huasheng Industrial Co.,Ltd",CHINA,Zhejiang, 315300 , Cixi,No.277 North Park Road Cixi,True,False,False,False,False,False,False,True,False,60.0,40.0,,False,,,,,,1,500
Cms Cavus Metal Tekstil Loj.Tas.San.Tic.A.S.,Bartu Dis Tic. A.S.Z,TURKEY,Kahramanmaras, 46200 , Kahramanmaras,Eyup Sultan Mahallesi Recep Tayyip Erdogan Bulvari No:150,True,False,False,False,False,False,True,True,True,50.0,50.0,,False,,,,,,1,500
Cofil S.R.L.,Cofil S.R.L.,ITALY,Prato, 59013 , Montemurlo,"Via Dell'Artigianato, 5",True,False,False,False,False,False,True,False,True,,,,False,,,,,,,
Ste' Mechri Startex Sarl,Benetton Industrielle Tunisie Sarl,TUNISIA,Gafsa, 2100 , Gafsa,20 Z.I. Borj Elakarema-Mdhilla,True,False,False,True,False,False,False,False,False,6.0,94.0,0.0,False,,l,84.0,,     ,1,500
Ste Naceur Maghmaghi,Benetton Industrielle Tunisie Sarl,TUNISIA,Monastir, 5050 , Moknine,Rue De Zaghouan,True,False,False,True,False,False,False,False,False,15.0,85.0,,False,,,,,,1,500
Ste Naima Anis Textile,Benetton Industrielle Tunisie Sarl,TUNISIA,Monastir, 5080 , Teboulba,Cite Riadh,True,False,False,True,False,False,False,False,False,6.0,94.0,0.0,False,,l,100.0,,,1,500
Ste' Nejia-Tex Sarl,Benetton Industrielle Tunisie Sarl,TUNISIA,Gafsa, 2100 , Gafsa,Cite Essourour,True,False,False,True,False,False,False,False,False,10.0,90.0,0.0,False,,l,100.0,,,1,500
Ste' Perfuco 2 Sarl,Benetton Industrielle Tunisie Sarl,TUNISIA,Monastir, 5020 , Jemmel,Rue El Basatin,True,False,False,True,False,False,False,False,False,5.0,95.0,0.0,False,,l,93.0,,     ,1,500
Ste' Racine Mode Sarl,Benetton Industrielle Tunisie Sarl,TUNISIA,Monastir, 5031 , Ksibet El Mediouni,Avenue 7 Nouvembre,True,False,False,True,True,False,False,False,False,15.0,85.0,0.0,False,,l,100.0,,,1,500
Ste Royaume Sh,Benetton Industrielle Tunisie Sarl,TUNISIA,Monastir, 5050 , Moknine,Rue Okba Ebn Nafaa,True,False,False,True,False,False,False,False,False,5.0,95.0,0.0,False,,l,97.0,l,,1,500
Ste Serimaille,Benetton Industrielle Tunisie Sarl,TUNISIA,Monastir, 5050 , Moknine,Rue Arbi Zarrouk,True,False,False,True,False,False,False,False,False,7.0,93.0,0.0,False,,l,100.0,,,1,500
Ste Sigmatex,Benetton Industrielle Tunisie Sarl,TUNISIA,Monastir, 5070 , Ksar Hellal,Rue Hedi Nouira,True,False,False,True,False,False,False,False,False,10.0,90.0,0.0,False,,l,100.0,,,1,500
Ste Supply Chain Fashion,Benetton Industrielle Tunisie Sarl,TUNISIA,Monastir, 5041 , Monastir,Rue Farhat Hached,True,False,False,True,False,False,False,False,False,50.0,50.0,,False,,,,,,1,500
Cotonificio Olcese Ferrari Spa,Cotonificio Olcese Ferrari S.P.A,ITALY,Brescia, 25030 , Adro,"Via Marzaghette, 7",True,False,False,False,False,False,False,False,True,61.0,39.0,,False,,,,,,1,500
Creative Dyeing And Printing Mills Pvt. Ltd.,Radnik Exports,INDIA,Haryana, 121003 , Faridabad,14/3 Main Mathura Road,True,False,False,False,False,False,False,False,True,100.0,0.0,,False,,,,,,1,500
Ste' Tex Print Cut Sarl,Benetton Industrielle Tunisie Sarl,TUNISIA,Kasserine, 1200 , Kasserine,Zone Ind. Route De Thala,True,False,False,True,False,False,False,False,False,35.0,65.0,0.0,False,,l,100.0,,,1,500
Ste Together Always,Benetton Industrielle Tunisie Sarl,TUNISIA,Monastir, 5031 , Monastir,Rue N 09 Avril,True,False,False,True,False,False,False,False,False,20.0,80.0,,False,,,,,,1,500
Cta Apparels Pvt Ltd  Unit - Hapur,Cta Apparels Pvt Ltd,INDIA,Uttar Pradesh, 245304 , Pilkhuwa,Plot No 26-29/Textile Centre Yojna,True,False,False,False,True,False,False,False,True,100.0,0.0,,False,,,,,,1,500
Ste' Tounsi Confection Sarl,Benetton Industrielle Tunisie Sarl,TUNISIA,Monastir, 5050 , Moknine,Rue De Tunis,True,False,False,True,False,False,False,False,False,2.0,98.0,0.0,False,,l,100.0,,,1,500
Ste' Wajih -Tex Sa,Benetton Industrielle Tunisie Sarl,TUNISIA,Gafsa, 2100 , Gafsa,Cite Ennour,True,False,False,True,False,False,False,False,False,3.0,97.0,0.0,False,,l,100.0,,     ,1,500
Union Frere Confection,Benetton Industrielle Tunisie Sarl,TUNISIA,Monastir, 5080 , Monastir,Rue De La Republique Soukrine,True,False,False,True,False,False,False,False,False,10.0,90.0,0.0,False,,l,100.0,,,1,500
D.D. Fashion,Radnik Exports,INDIA,Delhi, 110020 , New Delhi,"B-69, Pocket C, Okhla Phase I, Industrial Area",True,False,False,False,False,False,False,True,False,84.0,16.0,,False,,,,,,1,500
"Dae Nam Textile Co., Ltd",Sunhong Global Investment Limited,SOUTH KOREA,Daegu, 41709 , Daegu,"2F Ssang Ho Bldg, 1812 Bisan Dong, Seo-Gu",True,False,False,False,False,False,False,True,False,,,,False,,,,,,1,500
"Dalian Hongyang Garment Washing Co.,Ltd","Richland(Liaoning)Int'L Co., Ltd",CHINA,Liaoning, 116200 , Dalian,"No.79 Yangshufang Economic Development District, Pulandian District",True,False,False,False,False,False,False,False,True,93.0,7.0,8.0,False,,,,l,,1,500
Venus Confection Sarl,Benetton Industrielle Tunisie Sarl,TUNISIA,Sfax, 3052 , Impasse Marouan,Route De Gabes Km 4,True,False,False,True,False,False,False,False,False,3.0,97.0,0.0,False,,l,100.0,l,,1,500
Zago S.N.C.,Zago S.N.C.,ITALY,Treviso, 31050 , Ponzano Veneto,"Via Camalo', 66",True,False,False,True,True,False,False,False,False,10.0,90.0,,False,,,,,,1,500
Zina Textile,Benetton Industrielle Tunisie Sarl,TUNISIA,Sousse, 4070 , Sousse,Route Sfax Bni Kalthoum Msaken,True,False,False,True,False,False,False,False,False,8.0,92.0,0.0,False,,l,100.0,,,1,500
Acqua Design Italia S.R.L.,Acqua Design Italia S.R.L.,ITALY,Treviso, 31010 , Cimadolmo,"Via Della Carrera, 28",True,False,False,True,False,False,False,False,True,80.0,20.0,,False,,,,,,1,500
Ada Design Uluslararasi Tekstil Sanayi Ve Ticaret A.S.,Tuline Tekstil San Ve Tic A.S.,TURKEY,Izmir, 35000 , Izmir,Buca Osb Yahya Kemal Bayatli Caddesi No: 28 Buca ,True,False,False,True,False,False,False,False,False,28.0,72.0,0.0,False,,,,l,,1,500
Ada Triko Tekstil San. Tic. Ltd. Şti,Ada Triko Tekstil San. Tic. Ltd. Şti,TURKEY,Istanbul, 34164 , Istanbul,Güven Mah Eski Londra Asfalti Cad.No:59 Güngören,True,False,False,True,False,False,False,False,False,60.0,40.0,0.0,False,,,,,ICS   ,1,500
Aemme Di De Marchi M. & C. S.N.C.,Aemme Di De Marchi M. & C. S.N.C.,ITALY,Treviso, 31055 , Quinto Di Treviso,"Via San Cassiano, 27",True,False,False,True,False,False,False,False,False,0.0,100.0,,False,,,,,,1,500
Akin Tekstil As,Aktek Giyim San. Ve Tic. As.,TURKEY,Kirklareli, 39730 , Luleburgaz,Gundogu Mah. 1.Cad. No:11 Evrensekiz,True,False,False,True,False,False,False,False,False,65.0,35.0,0.0,True,TEKSIF affliated to the TURK-IS Confederation.,l,100.0,l,ISO 14001; ISO 27001; EUROPEAN FLAX; OEKO-TEX ,501,1500
Akkus Tekstil San Dis Tic As,Akkus Tekstil San Dis Tic As,TURKEY,Mardin, 47420 , Mardin,Mardin Osb 1 Bulvar Vali Fikret Guven Cad.19 Sk N° 11/2 Artuklu,True,False,False,True,False,False,False,False,True,63.0,37.0,0.0,False,,,,l,,1,500
