Merkoteks Tekstil San. Ve Tic.A.S.,Global Sourcing Dis Tic A.S,TURKEY,Istanbul, 34212 , Istanbul,"15 Temmuz Mh. Halkah Cad. No: 113, Gunesli, Bagcilar",True,False,False,True,False,False,False,False,True,68.5,31.5,0.0,False,,,,l,GOTS; GRS;  OCS; RCS,501,1500
Minoronzoni Srl Bergamo ( Sucursala Sibiu),Mino Ronzoni,ROMANIA,Sibiu, 550018 , Sibiu,"Strada Europa Unita, 13",False,True,False,True,False,False,False,False,False,25.0,75.0,0.0,False,,l,100.0,l,VF CORPORATION,1,500
Miroglio Maroc Factory,Miroglio Textile S.R.L,MOROCCO,Casablanca, 20610 , Casablanca,Lot Mauritania F33 Sidi Bernoussi,True,False,False,True,False,False,False,False,False,10.0,90.0,0.0,False,,,,l,GOTS     ,1,500
Motif Global Tekstil San.Tic.As,Motif Global Tekstil San. Ve Tic. A.S.,TURKEY,Denizli, 20000 , Denizli ,Akcesme Mah.2056 Sk N° 15 Merkezefendi,False,True,False,True,False,False,False,False,False,33.0,67.0,,False,,,,l,,1,500
Shahi Exports Pvt.Ltd. Shimoga Unit 101(Kpd),Shahi Exports Pvt Ltd.,INDIA,Karnataka, 577222 , Shimoga,"No – 101, Sy.No.156,Kiadb Industrial Area. Nidige Post",True,False,False,False,False,False,False,True,False,59.0,41.0,,False,,,,,,1501,3000
Shahi Exports Pvt.Ltd. Shimoga Unit 105(Wpd),Shahi Exports Pvt Ltd.,INDIA,Karnataka, 577222 , Shimoga,"Sy.No.156, Kiadb Industrial Area, Nidige, Shivamogga",True,False,False,False,False,False,False,True,True,81.0,19.0,,False,,,,,,501,1500
"Shandong Hengtai Textile Co., Ltd. (Zhongxin South Street)",Ever Brighton (Hk) Ltd,CHINA,Shandong, 276000 , Linyi,"Tengfei West Rd,Yishui County",True,False,False,False,False,False,True,False,True,,,0.0,True,Shandong Linyi Worker Union,,,l,,1,500
Muchhala N.V.,Muchhala N.V.,INDIA,Maharashtra, 400062 , Mumbai,"Muchhala House, 166 Bangur Nagar, Yoga Niketan Marg, Near Ayyapa Temple",False,True,False,True,False,False,False,False,False,48.0,52.0,0.0,False,,,,,,1,500
"Shanghai Adt Trading Co.,Ltd.",Talisman Ltd,CHINA,Shanghai, 200233 , Shanghai,"Rm.1106, Bldg# C,No.70, Caobao Road, Xuhui District",True,False,False,False,False,False,True,False,False,85.0,15.0,,False,,,,,,1,500
Shanghai Xietong Group Co. Ltd,Alpi (Hong Kong) International Company Limited.,CHINA,Shanghai, 201804 , Jiading,"No.18, Lane 318, Yonghe Road, Zhabei Dist",True,False,False,False,False,False,True,True,False,60.0,40.0,,False,,,,,,1,500
"Myanmar Ha Hae Co., Ltd.",Ha Hae Corporation,MYANMAR,Yangon, 11161 , Yangon,"Plot No. 90-91, Daw Phwar Shin Street, Dagon Seikan Industrial Zone Part-1, Dagon Myothit(Seikan) Township",True,False,False,True,False,False,False,False,False,94.0,6.0,1.0,True,Labor Union,l,100.0,l,GRS; RDS  ,1501,3000
Shanxi Green Land Textile Co Ltd.,"Richland(Liaoning)Int'L Co., Ltd",CHINA,Shanxi, 048000 , Jincheng,"Bajiakou Twon, Yangchen County",True,False,False,False,False,False,False,True,False,30.0,70.0,,False,,,,,,501,1500
"Shaoguan Beijiang Smart Textile Technology Co., Ltd   ",S.F. Fashion Wears Ltd,CHINA,Guangdong, 512721 , Shaoguan,No.3 Qujiang Economic Development Zone,True,False,False,False,False,False,True,True,True,48.0,52.0,9.0,True,All-China federation of trade unions,,,l,,501,1500
"Shaoxing Jinshen Printing & Dyeing Co., Ltd",Shahi Exports Pvt Ltd.,CHINA,Zhejiang, 312000 , Shaoxing,Binhai Industrial Zone,True,False,False,False,False,False,False,True,True,60.0,40.0,,False,,,,,,501,1500
Shaoxing Keqiao Dasheng Knitting Co.Ltd,Talisman Ltd,CHINA,Zhejiang, 312000 , Shaoxing,"Block 21,Yuelong Industrial Zone Keqiao District",True,False,False,False,False,False,False,True,False,20.0,80.0,,False,,,,,,1,500
Shaoxing Keqiao Dasheng Knitting Co.Ltd (Weaving Mill),Talisman Ltd,CHINA,Zhejiang, 312000 , Shaoxing,"Xinbin Road, Binhai Industrial Park",True,False,False,False,False,False,False,True,False,20.0,80.0,,False,,,,,,1,500
"Shaoxing Keqiao Keyuan Textile Co., Ltd",Great Pacific Enterprises Ltd,CHINA,Zhejiang, 312000 , Shaoxing,"No.1234 Anhua North Road, Qixian Disctriction,Keqiao District",True,False,False,False,False,False,False,True,False,42.0,58.0,,False,,,,,,1,500
Shaoxing Kewang Textile Company Limited,China Ting Garment Mfg（Group） Ltd,CHINA,Zhejiang, 312000 , Shaoxing,"Kexi Industrial Complex,No.335 Hengjiang Road",True,False,False,False,False,False,False,True,False,,,,False,,,,,,,
"Shaoxing Quntai Textile Co.,Ltd",Great Pacific Enterprises Ltd,CHINA,Zhejiang, 312072 , Shaoxing,"Room 2502,Huangqiu Building,No 1268 Yumin Road,Keqiao",True,False,False,False,False,False,True,True,False,55.0,45.0,,False,,,,,,1,500
Shaoxing Renshuai,"Jiangsu Guotai Huasheng Industrial Co.,Ltd",CHINA,Zhejiang, 312000 , Shaoxing,"5Th Floor Block 15, Hutang Keqiao",True,False,False,False,False,False,False,True,False,70.0,30.0,,False,,,,,,1,500
Shaoxing Ruiqi Textile Co.Ltd,Great Pacific Enterprises Ltd,CHINA,Zhejiang, 312020 , Shaoxing,"Room 1604-3, Yuancheng Building, Didang Street",True,False,False,False,False,False,False,True,False,,,,False,,,,,,,
"Shaoxing Suhong Knitting Co., Ltd.",Talisman Ltd,CHINA,Zhejiang, 312072 , Shaoxing,"Room 502, 5Th Floor, Building 1, No. 18, Xing'An West Road, Dashan West Village, Anchang Street, Keqiao District",True,False,False,False,False,False,False,True,False,30.0,70.0,,False,,,,,,1,500
Shaoxing Xingming Dyeing & Finishing Co. Ltd.,Ventdest Garments Co Ltd,CHINA,Zhejiang, 312030 , Shaoxing,"No.511 Binxing Road, Binhai Industrial Area",True,False,False,False,False,False,False,False,True,60.0,40.0,,False,,,,,,1,500
"Shaoxing Xiujin Knitting & Textile Co., Ltd",Ventdest Garments Co Ltd,CHINA,Zhejiang, 312000 , Shaoxing,"South Of Qisheng Road, Paojiang",True,False,False,False,False,False,False,True,False,60.0,40.0,,False,,,,,,1,500
"Sheng Qin Textile Co.,Ltd.",Pavilion Investment Ltd,CHINA,Guangdong, 516127 , Hui Zhou,"Hua Yang Industrial, Jiu Tan, Yan Zhou Town, Boluo",True,False,False,False,False,False,False,True,True,57.0,43.0,,False,,,,,,1,500
"Nanan Nanfa Woolen Knitwear Co., Ltd.",South Asia Enterprises Ltd,CHINA,Fujian, 362000 , Quanzhou,"292 Main Street, Jintao Town, Nanan, Quanzhou",True,False,False,True,False,False,False,False,True,30.0,70.0,2.0,True,Unknown,,,l,,501,1500
Shine Embroidery&Printing Ltd,Debonair Limited,BANGLADESH,Dhaka, 1349 , Dhaka,"198 Gazir Chat, Maddhapara",True,False,False,False,False,True,False,False,False,,,,False,,,,,,,
"Shishi Zhanyao Textile Technology Co,.Ltd",Lavender Garment Ltd,CHINA,Fujian, 362000 , Xiangzhi,Da Bao Development Zone,True,False,False,False,False,False,False,False,True,,,,False,,,,,,1,500
Shree Tirupati Textile Weave,Shahi Exports Pvt Ltd.,INDIA,Gujarat, 395002 , Surat,"36,Vishal Ind, Gujara, Near Santi Nath Mill",True,False,False,False,False,False,False,True,False,60.0,40.0,,False,,,,,,1,500
Shri Lakshimi Textiles Process,C.R.Garments,INDIA,Tamil Nadu, 641605 , Tirupur,"Sf No-47/1 Kosavankadu, Karaipudur Village, Arulpuram (Po)",True,False,False,False,False,False,False,False,True,96.0,4.0,,False,,,,,,1,500
Sidonios Malhas S.A.,Sidonios Malhas S.A.,PORTUGAL,Braga, 4754-909 , Barcelos,Lugar De Quiraz Roriz Ap.284,True,False,False,False,False,False,False,True,False,,,,False,,,,,,,
Silvana Filati Di Gori Roberto,Cofil S.R.L.,ITALY,Pistoia, 51038 , Quarrata,"Via Pietro Maroncelli, 27",True,False,False,False,False,False,True,False,False,,,,False,,,,,,1,500
"Silver Composite Textile Mills Ltd. (Unit-03, Textile Division)",Tarasima Apparels Ltd,BANGLADESH,Dhaka, 283203 , Gazipur,"B.K Bari, Taltoly, Monipur, Mirzapur Bazar, Sadar",True,False,False,False,False,False,False,True,True,95.0,5.0,,False,,,,,,501,1500
Sister Denim Composite Ltd,Laila Styles Ltd,BANGLADESH,Dhaka, 1620 , Narsingdi,"Karardi, Shibpur.",True,False,False,False,False,False,False,True,True,100.0,0.0,45.0,False,,,,l,,501,1500
Nastrificio Di Signoressa S.R.L.,Nastrificio Di Signoressa S.R.L.,ITALY,Treviso, 31040 , Signoressa Di Trevignano,Via Treviso 109,True,False,False,True,False,False,False,False,False,,,,False,,,,,,1,500
Nath Bross Exim International Ltd.,Nath Bros Exim International Ltd.,INDIA,Uttar Pradesh, 201301 , Noida ,C-32. Sector 57,False,True,False,True,False,False,False,False,False,85.0,15.0,,False,,,,l,SMETA; GRS; GOTS,1,500
New Chaltex,Benetton Industrielle Tunisie Sarl,TUNISIA,Monastir, 5021 , Bembla,Rue Tarek Ben Zied,True,False,False,True,False,False,False,False,False,,,0.0,False,,,,,,1,500
Ng Tex Srl,Benetton Tekstil D.O.O.,ROMANIA,Dolj, 200030 , Craiova,Str Simion Stoilov Nr 7,True,False,False,True,False,False,False,False,False,6.0,94.0,,False,,,,,,1,500
Nicole S.R.L.,Nicole S.R.L.,ITALY,Treviso, 31038 , Villorba,"Via Trieste, 91",True,False,False,True,False,False,False,False,False,13.0,87.0,,False,,,,,,1,500
Societe Bis Brodland,Benetton Industrielle Tunisie Sarl,TUNISIA,Kasserine, 1200 , Kasserine,Zone Industrielle Route Thala,True,False,False,False,True,False,False,False,False,20.0,80.0,,False,,,,,,1,500
Norman Srl,Norman Srl,ITALY,Mantova, 46042 , Castel Goffredo,"Via Grecia, 2",True,False,False,True,False,False,False,False,False,67.0,33.0,22.0,False,,l,100.0,l,OEKO-TEX;,1,500
Nova Konfekcija D.O.O.,Benetton Tekstil D.O.O.,CROATIA,Osijek, 31300 , Beli Manastir,"Bele Bartoka, 13",True,False,False,True,True,True,False,False,False,1.0,99.0,0.0,False,,,,l,,1,500
Nuova Shoes,Nuova Shoes,INDIA,Uttar Pradesh, 201301 , Noida,"Plot No. B23, Sector 83",False,False,True,True,False,False,False,False,False,70.0,30.0,61.0,False,,,,l,SA 8000; ISO 9000,1,500
Nuova Stirlady Srl,Nuova Stirlady Srl,ITALY,Treviso, 31033 , Castelfranco Veneto,"Via Sile, 37",True,False,False,True,False,False,False,False,False,30.0,70.0,,False,,,,,,1,500
Nuove Confezioni Polesane Srls,Nuove Confezioni Polesane Srls,ITALY,Rovigo, 45014 , Porto Viro,Via Dell'Artigianato 7/B,True,False,False,True,False,False,False,False,False,30.0,70.0,,False,,,,,,1,500
Benetton Knitting Serbia D.O.O.,Benetton Serbia D.O.O.,SERBIA,Nis, 18000 , Nis,"Pantelejska, 58",True,False,False,True,True,False,False,True,False,9.0,39.0,0.0,False,,,,,,501,1500
Benetton Industrielle Tunisie Sarl,Benetton Industrielle Tunisie Sarl,TUNISIA,Monastir, 5012 , Sahline,Route De Sousse Oued Hamdoun,True,False,False,True,True,True,False,False,True,89.0,11.0,0.0,False,,l,100.0,l,,1,500
Benetton Serbia D.O.O.,Benetton Serbia D.O.O.,SERBIA,Nis, 18000 , Nis,"Pantelejska, 58",True,False,False,True,True,True,False,True,True,,,0.0,False,,,,,,1,500
Benetton Tekstil D.O.O.,Benetton Tekstil D.O.O.,CROATIA,Osijek, 31000 , Osijek,Vukovarska Cesta 219A,True,False,False,True,True,False,False,True,True,39.0,61.0,0.0,True,Klas,,,l,,1,500
Ozdilek Ev Tekstil San Ve Tic A.S.,Ozdilek Ithalat Ihracat Ve Pazarlama Ltd,TURKEY,Bursa, 16210 , Bursa,Soganli Mh. Istanbul Cd. No. 343/ Osmangazi,False,True,False,True,False,False,False,False,False,45.0,55.0,0.0,False,,,,l,,501,1500
Palm Stitch Sarl,Miroglio Textile S.R.L,MOROCCO,Sale, 11015 , Sale,60 Rue Otmane Bnou Affan Zone Industriel Tabriquet,True,False,False,True,False,False,False,False,False,18.0,82.0,0.0,False,,,,l,,501,1500
Pankaj Mercantile Company,Pankaj Mercantile Company,INDIA,Maharashtra, 400093  , Andheri (East) Mumbai,"101 Everest House, 6 Suren Road, ",False,True,False,True,False,False,False,False,False,21.0,79.0,0.0,False,,,,l,,1,500
Pari Garment Sarl,Platform And Design,MOROCCO,Tangier-Assilah, 90100 , Tanger,Zone Franche D'Exp Ilot 61 N 7,True,False,False,True,False,False,False,False,False,45.0,55.0,0.0,False,,,,l,,1,500
Platform And Design,Platform And Design,MOROCCO,Tangier-Assilah, 90000 , Tangier,"Zone Franche D' Exportation Ilot N°4, Lot N°1",True,False,False,True,False,False,False,False,False,56.0,44.0,,False,,,,,,1,500
Prima Tex Export,Benetton Industrielle Tunisie Sarl,TUNISIA,Monastir, 5050 , Monastir,Av Farhat Hached Route De Teboulba,True,False,False,True,False,False,False,False,False,10.0,90.0,0.0,False,,l,100.0,l,,1,500
Pwr Fashion Company Limited,Pwr Fashion Company Limited,MYANMAR,Yangon, 11411 , Shwe Pyi Thar Township,"No.287/(C/D),No(4)Main Road Ward(4)'Thardukan Industrial Zone, Shwe Pyi Thar Township,Yangon, Myanmar",True,False,False,True,False,False,False,False,False,96.0,4.0,2.0,False,,,,l,,1501,3000
Qingdao H&H Jewelry Co. Ltd.,Edge Accessories Ltd,CHINA,Shandong, 266300 , Jiaozhou City,"West Of Weijiatun Village, Ligezhuang Town",False,True,False,True,False,False,False,False,False,28.0,72.0,14.0,False,,l,100.0,l,,1,500
"Qualite Apparel (Dongguan) Mfg Co. , Ltd",Pavilion Investment Ltd,CHINA,Guangdong, 523000 , Dongguan,"No.3 Maan Second Road, Shuiwei Industrial Zone, Tangjiao Village, Chashan Town, Dongguan City",True,False,False,True,False,False,False,False,False,40.0,60.0,27.0,True,Qualite Apparel (Dongguan) Mfg Co Ltd Employee union,l,100.0,l,GOTS; OCS   ,1,500
Sonmez Pamuklu Sanayi A.S.,Pergamon Status Dis Ticaret As,TURKEY,Bursa, 16245 , Osmangazi,Yeni Yalova Blv. 9 Km D:No:568,True,False,False,False,False,False,True,False,False,,,,False,,,,,,1,500
Quick Italia Srl,Quick Italia Srl,ITALY,Treviso, 31050 , Villorba,Via Edison 55,True,False,False,True,False,False,False,False,False,5.0,95.0,,False,,,,,,1,500
Radnik Exports,Radnik Exports,INDIA,Uttar Pradesh, 201301 , Noida,"D-227, Sector-63",True,False,False,True,False,False,False,False,False,60.0,40.0,11.0,False,,,,l,,501,1500
Sprint Color S.R.L.,Sprint Color S.R.L.,ITALY,Treviso, 31033 , Castelfranco Veneto,"Via San Francesco D'Assisi, 29",True,False,False,False,False,True,False,False,False,58.0,42.0,,False,,,,,,1,500
Radnik Exports D - 201,Radnik Exports,INDIA,Uttar Pradesh, 201301 , Noida,"D-201, Sector-63",True,False,False,True,False,False,False,False,True,60.0,40.0,20.0,False,,,,l,ISO 14001; ISO 45001 ,1501,3000
Square Denims Ltd,Tarasima Apparels Ltd,BANGLADESH,Sylhet, 3332 , Habiganj,"Olipur, Shajibazar, Shayestaganj, Habiganj, Sylhet",True,False,False,False,False,False,False,True,True,,,0.0,False,,,,l,,1,500
Sri Lakshimi Knitters,C.R.Garments,INDIA,Tamil Nadu, 641607 , Tirupur,"D No 3/299-D, Vengatachalapathi Nagar, Parapalayam Pirivu, Mannarai (Po)",True,False,False,False,False,False,False,True,False,95.0,5.0,,False,,,,,,1,500
Stamperia Di Martinengo Srl,Miroglio Textile S.R.L,ITALY,Bergamo, 24057 , Mantinengo,Via A. Pinetti N. 44,True,False,False,False,False,False,False,True,True,62.0,38.0,,False,,,,,,1,500
Rakam Exports,Rakam Exports,INDIA,Uttar Pradesh, 201301 , Noida,"D-73 , Sector 63",False,True,False,True,False,False,False,False,False,74.0,26.0,13.0,False,,,,l,"SMETA, GOTS",1,500
"Richland Dalian Apparel Co., Ltd","Richland(Liaoning)Int'L Co., Ltd",CHINA,Liaoning, 116000 , Dalian,"No. 1 Songjiang Road,Economic And Technological Development Zone, Dalian China",True,False,False,True,False,False,False,False,False,34.0,66.0,0.0,True,Unknown,,,l,BSCI,1,500
Ring Proizvodnja Odjece Obrt,Benetton Tekstil D.O.O.,CROATIA,Osijek, 31400 , Dakovo,Industrijska Zona Bb,True,False,False,True,True,True,False,False,False,13.0,87.0,0.0,False,,,,l,,1,500
Rubyred Garment Manufacturing S.A.E,Rubyred Garment Manufacturing S.A.E,EGYPT,Alexandria, 21934 , Borg El Arab,"4Th Industrial Zone, Block 14, Plots 1-2-13-14",True,False,False,True,False,True,False,False,False,55.0,45.0,,False,,,,,,501,1500
Rugao Ruijing Garment,The Hat Company Ltd,CHINA,Guangdong, 226500 , Rugao,"No.18 Qingyu Road, Rucheng Town",False,True,False,True,False,False,False,False,False,10.0,90.0,0.0,False,,,,l,,1,500
S.C. Maglierie Cristian Impex Srl,Benetton Tekstil D.O.O.,ROMANIA,Dolj, 205200 , Calafat,"Str. Traian, 2",True,False,False,True,False,False,False,True,False,10.0,90.0,0.0,False,,l,100.0,l,,1,500
S.F Denim Apparels Ltd.,S.F Denim Apparels Ltd,BANGLADESH,Dhaka, 1208 , Dhaka,430-431/ B Tejgaon I/A,True,False,False,True,False,False,False,False,False,29.0,71.0,0.0,True,S. F. Denim Apparels Limited Combined Garments Workers Union,l,80.0,,,501,1500
S.F.Fashion Wears Ltd,S.F. Fashion Wears Ltd,BANGLADESH,Dhaka, 1430 , Narayanganj,"Nayabari, Kanchpur, Sonargaon",True,False,False,True,False,False,False,False,False,37.0,63.0,17.0,False,,,,l,SMETA     ,501,1500
Samik Export,Samik Exports (India) Pvt. Ltd.,INDIA,Haryana, 122050 , Gurgaon,"No. 104, 105, Sector 5, I M T Manesar",False,True,False,True,False,False,False,False,False,99.0,1.0,0.0,False,,,,l,,1,500
Sandy Shoes Srl,Sandy Shoes Srl,ITALY,Lucca, 55018 , Capannori,"Via Di Piaggiori, 281",False,False,True,True,False,False,False,False,False,45.0,55.0,0.0,False,,,,l,,1,500
Sanko Tekstil Isletmeleri Sanayi Ve Ticaret As,Skytekstil Sp Zoo,TURKEY,Gaziantep, 26700 , Gaziantep,"3, Osb, Baspinar",True,False,False,True,False,False,True,True,True,87.0,13.0,,True,TEK-SİF (TÜRKİYE TEKSTİL ÖRME GİYİM VE DERİ SANAYİ İŞÇİLERİ SENDİKASI) -,l,100.0,l,SA 8000; OEKO-TEX; ISO 9000,501,1500
Sc Gnoato Est S.R.L.,Benetton Tekstil D.O.O.,ROMANIA,Sibiu, 557150 , Sibiu,"Matalurgistilor, 1/3",True,False,False,True,True,False,False,True,True,14.0,86.0,0.0,False,,l,100.0,l,,1,500
Sc Parivaar Conf Srl,Benetton Tekstil D.O.O.,ROMANIA,Bihor, 410264 , Oradea,Str. Primariei 32,True,False,False,True,False,False,False,False,False,9.0,91.0,,False,,,,,,1,500
Sc Trico Point S.R.L.,Benetton Tekstil D.O.O.,ROMANIA,Dambovita, 135200 , Gaesti,"Str. 13 Decembrie, 206",True,False,False,True,False,False,False,False,True,15.0,85.0,,False,,,,,,1,500
Sc. Molda Exclusiv. Srl,Benetton Tekstil D.O.O.,ROMANIA,Sibiu, 550365 , Sibiu,"Str Nicolae Teclu,  29-31",True,False,False,True,False,False,False,False,False,0.0,100.0,,False,,,,,,1,500
Sevenpull Doo,Benetton Tekstil D.O.O.,BOSNIA AND HERZEGOVINA,Bijeljina, 76300 , Bijeljina,Hase 36,True,False,False,True,False,False,False,False,False,10.0,90.0,0.0,False,,,,,,1,500
Shahi 12,Shahi Exports Pvt Ltd.,INDIA,Karnataka, 560076 , Bangalore,"37/1B,43/2, 43/3 Arekere, Bannerghatta Main Road",True,False,False,True,False,True,False,False,False,34.0,66.0,0.0,False,,,,l,SMETA,5000,
Shahi Exports Pvt Ltd,Shahi Exports Pvt Ltd.,INDIA,Karnataka, 560068 , Bangalore,"38/4B Hongasandra Village , Hosur Main Road",True,False,False,True,False,False,False,False,False,36.0,64.0,0.0,False,,,,l,,501,1500
Shahi Exports Pvt Ltd,Shahi Exports Pvt Ltd,INDIA,Uttar Pradesh, 201301 , Noida,"D-201, Sector-63, Noida, Gautam Budh Nagar",True,False,False,True,False,False,False,False,False,60.0,40.0,,False,,,,l,,5000,
Shahi Exports Pvt Ltd Unit-9,Shahi Exports Pvt Ltd,INDIA,Karnataka, 560058 , Bangalore,"No171, 7Th Main Road, Industrial Suburb, Peenya 2Nd Stage",True,False,False,True,False,False,False,False,True,30.0,70.0,1.0,False,,,,l,,1501,3000
Shandong Tuoda Shoes Co Ltd,Multibiz Limited,CHINA,Shandong, 273500 , Jining,"No.006 Hongji Road, Zoucheng Industrial Park, Jining",False,False,True,True,False,False,False,False,False,8.0,92.0,0.0,False,,,,l,,1,500
Shangtex (Huai An) Gmt Co. Ltd,"Shangtex Garment Co.,Ltd",CHINA,Jiangsu, 223301 , Huaian City,"No 638 The North Of Xiangyu Rd, Huaian City",True,False,False,True,False,False,False,False,False,7.0,93.0,0.0,False,,,,l,,1,500
Shengjie (Myanmar) Clothing Co. Ltd,"Jiangsu Guotai Huasheng Industrial Co.,Ltd",MYANMAR,Yangon, 11401 , Yangon,"Plot No.296/297, Shwe Lin Pan Industrial Zone, Myay Taing Block No.25, Hlaing Thar Yar,Yangon Region",True,False,False,True,False,False,False,False,False,13.0,87.0,7.0,False,,,,l,,501,1500
Socaf Sarl,Benetton Industrielle Tunisie Sarl,TUNISIA,Monastir, 5050 , Moknine,Rue Arbi Zarrouk,True,False,False,True,False,False,False,False,False,6.0,94.0,0.0,False,,l,100.0,,,1,500
Ste' Desitunis Sarl,Benetton Industrielle Tunisie Sarl,TUNISIA,Tunis, 4000 , Abdel Hamid,Zone Ind. Sidi,True,False,False,False,False,True,False,False,False,40.0,60.0,0.0,False,,l,100.0,,,1,500
Socaf2 Sarl,Benetton Industrielle Tunisie Sarl,TUNISIA,Monastir, 5050 , Moknine,Rue Essabkha 1,True,False,False,True,False,False,False,False,False,8.0,92.0,0.0,False,,l,100.0,l,,1,500
Societe 2 M Confection Sarl,Benetton Industrielle Tunisie Sarl,TUNISIA,Monastir, 5045 , Zermadine,Centre Village Zeramdine,True,False,False,True,False,False,False,False,False,17.0,83.0,0.0,False,,l,100.0,,,1,500
Société Baha Confection,Benetton Industrielle Tunisie Sarl,TUNISIA,Kairouan, 3160 , Kairouan,Zone Industrielle Hajeb Elayoun,True,False,False,True,False,False,False,False,False,8.0,92.0,0.0,False,,l,100.0,,,1,500
Ste' Estamparia Mbf Sarl,Benetton Industrielle Tunisie Sarl,TUNISIA,Gafsa, 2100 , Gafsa,Zone Industrielle Elaguila,True,False,False,False,False,True,False,False,False,11.0,89.0,0.0,False,,l,100.0,,,1,500
Ste' Everwash Sarl,Benetton Industrielle Tunisie Sarl,TUNISIA,Monastir, 5021 , Bembla,Z.I. Route De Jemmel,True,False,False,False,False,False,False,False,True,44.0,56.0,0.0,False,,l,100.0,l,,1,500
Societe Bargougui Marwen Loujayene,Benetton Industrielle Tunisie Sarl,TUNISIA,Sidi Bouzid, 9100 , Sidi Bouzid,Route De Ceinture Cité Ouled Belhedi,True,False,False,True,False,False,False,False,False,7.0,93.0,0.0,False,,l,100.0,,,1,500
Societe Cesar Confection,Benetton Industrielle Tunisie Sarl,TUNISIA,Sidi Bouzid, 9122 , Essabela,Rue 7 Novembre,True,False,False,True,False,False,False,False,False,6.0,94.0,0.0,False,,l,100.0,,,1,500
Societe Chahdtex,Benetton Industrielle Tunisie Sarl,TUNISIA,Kasserine, 1212 , Kasserine,Route Kmouda Foussana,True,False,False,True,False,False,False,False,False,7.0,93.0,,False,,,,,,1,500
Societe Chaima De Confection Sarl,Benetton Industrielle Tunisie Sarl,TUNISIA,Kasserine, 1220 , Kasserine,Avenue 7 Nouvembre,True,False,False,True,False,False,False,False,False,,,,False,,,,,,1,500
Societe Elhamma Tex,Benetton Industrielle Tunisie Sarl,TUNISIA,Gabes, 6020 , Gabes,"Oued Ennour, Elhamma",True,False,False,True,False,False,False,False,False,3.0,97.0,,False,,,,,,1,500
Ste Ideal Broderie Confection Du Su,Benetton Industrielle Tunisie Sarl,TUNISIA,Gafsa, 2112 , Gafsa,Rue Sidi Ahmed Zarroug,True,False,False,False,True,False,False,False,False,25.0,75.0,0.0,False,,l,19.0,l,,1,500
Societe Fs Confection,Benetton Industrielle Tunisie Sarl,TUNISIA,Gabes, 6020 , Gabes,"000, L'Independance , Elhamma",True,False,False,True,False,False,False,False,False,8.0,92.0,,False,,,,,,1,500
Societe Gmaco,Benetton Industrielle Tunisie Sarl,TUNISIA,Kasserine, 4255 , Kasserine,Zone Industrielle 1280 Jedilliane,True,False,False,True,False,False,False,False,False,7.0,93.0,,False,,,,,,1,500
Societe Gtartex,Benetton Industrielle Tunisie Sarl,TUNISIA,Gafsa, 2180 , Gafsa,Rue Des Martyrs El Guetar,True,False,False,True,False,False,False,False,False,12.0,88.0,0.0,False,,l,100.0,,,1,500
Societe Hayet Di Confezione,Benetton Industrielle Tunisie Sarl,TUNISIA,Monastir, 5020 , Jemmel,Rue Sidi Ben Zid,True,False,False,True,False,False,False,False,False,,,,False,,,,,,1,500
Société Ishak Textile,Benetton Industrielle Tunisie Sarl,TUNISIA,Kasserine, 1221 , Kasserine,Rue Iben Charaf Hidra,True,False,False,True,False,False,False,False,False,,,,False,,,,,,1,500
Societe Isomeraze Sarl,Benetton Industrielle Tunisie Sarl,TUNISIA,Kasserine, 1200 , Kasserine,Zone Ind. Route De Sbeitla,True,False,False,True,False,False,False,False,False,6.0,94.0,0.0,False,,l,74.0,,,1,500
Societe Mayssa Confection Sarl,Benetton Industrielle Tunisie Sarl,TUNISIA,Kasserine, 1200 , Kasserine,Cite Elwelja - Sbeitla,True,False,False,True,False,False,False,False,False,3.0,97.0,0.0,False,,l,100.0,,,1,500
Societe Pallium Company,Benetton Industrielle Tunisie Sarl,TUNISIA,Sidi Bouzid, 9110 , Sidi Bouzid,Route Tunis Km1 Jelma,True,False,False,True,False,False,False,False,False,7.0,93.0,0.0,False,,l,100.0,,,1,500
Societe Souleima Confection Sarl,Benetton Industrielle Tunisie Sarl,TUNISIA,Kasserine, 1200 , Kasserine,Rue Gharnata - Cite Nour,True,False,False,True,False,False,False,False,False,7.0,93.0,0.0,False,,l,100.0,,,1,500
Societe Three-J Confection,Benetton Industrielle Tunisie Sarl,TUNISIA,Kasserine, 1200 , Kasserine,Rue El Manar,True,False,False,True,False,False,False,False,False,7.0,93.0,0.0,False,,l,100.0,l,     ,1,500
Societe Zi-Tex Sarl,Benetton Industrielle Tunisie Sarl,TUNISIA,Gafsa, 2100 , Gafsa,Route De Kass. Cite Ennour,True,False,False,True,False,False,False,False,False,4.0,96.0,0.0,False,,l,100.0,,,1,500
Souvetmaille Sarl,Miroglio Textile S.R.L,MOROCCO,Marrakech, 40150 , Marrakech,19/20 Q.I Azli Bp 5079 Iziki,True,False,False,True,False,False,False,False,False,35.0,65.0,0.0,True,Unknown,,,l,ECO VISCOSE LENZING,1,500
Sq Celsius Ltd.,Q Collection Pte. Ltd,BANGLADESH,Dhaka, 1740 , Gazipur,"Sq Celsius, Beraiderchala, Keowa, Maona, Sreepur",True,False,False,True,False,False,False,False,False,50.0,50.0,43.0,False,,,,l,SA8000; SMETA; GOTS; RWS; GRS     ,5000,
Ste' Abassi Confection,Benetton Industrielle Tunisie Sarl,TUNISIA,Sousse, 4040 , Sidi Bou Ali,Avenue Habib Bourguiba,True,False,False,True,True,False,False,False,False,6.0,94.0,0.0,False,,l,100.0,l,,1,500
Ste' Ab-Tex Sarl,Benetton Industrielle Tunisie Sarl,TUNISIA,Kasserine, 1200 , Kasserine,Cite Ettattathamen - Telepte,True,False,False,True,False,False,False,False,False,4.0,96.0,0.0,False,,l,100.0,l,     ,1,500
Ste' Atlas Textile Sarl,Benetton Industrielle Tunisie Sarl,TUNISIA,Monastir, 5045 , Zermadine,Rue Taher Sfar,True,False,False,True,False,False,False,False,False,7.0,93.0,0.0,False,,l,100.0,l,,1,500
Ste' Benatex Sarl,Benetton Industrielle Tunisie Sarl,TUNISIA,Kasserine, 1200 , Kasserine,Zone Ind. Route De Thala,True,False,False,True,False,False,False,False,False,5.0,95.0,0.0,False,,l,100.0,l,,1,500
Ste' Bentex Plus,Benetton Industrielle Tunisie Sarl,TUNISIA,Mahdia, 5180 , Ksour Essef,Rue Imen Ghazeli,True,False,False,True,False,False,False,False,False,6.0,94.0,0.0,False,,l,86.0,l,,1,500
Ste' Chokrie Yahia Conf. Plus Sarl,Benetton Industrielle Tunisie Sarl,TUNISIA,Mahdia, 5180 , Ksour Essef,Route De Bradaa,True,False,False,True,True,False,False,False,True,11.0,89.0,0.0,False,,l,100.0,l,,1,500
Ste' Dym Tex Sarl,Benetton Industrielle Tunisie Sarl,TUNISIA,Monastir, 5010 , Ouardanine,Rue De Sanaa,True,False,False,True,True,False,False,False,False,6.0,94.0,0.0,False,,l,100.0,l,,1,500
Ste' Es Confection Sarl,Benetton Industrielle Tunisie Sarl,TUNISIA,Monastir, 5011 , Khniss,Route De Monastir,True,False,False,True,True,False,False,False,False,18.0,82.0,0.0,False,,l,100.0,l,,1,500
